Id,Handle,Title
gid://shopify/Product/9272368595286,joop-jump-eau-de-toilette-spray-30ml,Joop! Jump 30ml Eau De Toilette Spray
gid://shopify/Product/9272368922966,dsquared2-red-wood-pour-femme-eau-de-toilette-spray-50ml,Dsquared2 Red Wood Pour Femme Eau De Toilette 50ml Spray
gid://shopify/Product/9272369152342,isseymiyake-leau-dissey-roll-on-deodorant-50ml,Issey Miyake L'Eau d'Issey Roll On Deodorant 50ml - Shop Now!
gid://shopify/Product/9272369381718,escada-sorbetto-rosso-limited-edition-eau-de-toilette-spray-100ml,Escada Sorbetto Rosso EDT Spray 100ml - Limited Edition
gid://shopify/Product/9272369643862,estee-lauder-beautiful-eau-de-parfum-spray-30ml,Estee Lauder Beautiful Eau De Parfum 30ml Spray
gid://shopify/Product/9272369807702,dana-chantilly-eau-de-toilette-104ml-spray,Dana Chantilly Eau de Toilette Spray - 104ml
gid://shopify/Product/9272370102614,britney-spears-festive-fantasy-eau-de-toilette-spray-100ml,Britney Spears Festive Fantasy EDT Spray 100ml
gid://shopify/Product/9272370430294,britney-spears-electric-fantasy-eau-de-toilette-spray-100ml,Britney Spears Electric Fantasy Eau De Toilette Spray - 100ml
gid://shopify/Product/9272370725206,tommy-hilfiger-men-eau-de-toilette-spray-100ml,Tommy Hilfiger Men Eau De Toilette Spray - 100ml
gid://shopify/Product/9272371020118,lacoste-l-12-12-blanc-eau-intense-eau-de-toilette-spray-50ml,Lacoste L.12.12 Blanc Intense Eau De Toilette Spray - 50ml
gid://shopify/Product/9272371315030,police-king-eau-de-toilette-125ml,Police King Eau De Toilette Spray 125ml
gid://shopify/Product/9272371577174,puig-agua-brava-men-eau-de-cologne-spray-100ml,Puig Agua Brava Men Eau De Cologne 100ml Spray
gid://shopify/Product/9272371904854,estee-lauder-youth-dew-eau-de-parfum-spray-67ml,Estee Lauder Youth Dew Eau De Parfum 67ml Spray
gid://shopify/Product/9272372035926,vera-wang-women-eau-de-parfum-spray-100ml,Vera Wang Women's Eau de Parfum Spray 100ml
gid://shopify/Product/9272372232534,jimmy-choo-blossom-eau-de-parfum-spray-40ml,Jimmy Choo Blossom Eau De Parfum Spray - 40ml
gid://shopify/Product/9272372396374,hugo-boss-boss-man-deo-spray-150ml,Hugo Boss Boss Man Deodorant Spray - 150ml
gid://shopify/Product/9272372724054,nina-ricci-lair-du-temps-eau-de-toilette-spray-30ml,Nina Ricci L'air Du Temps Eau De Toilette Spray - 30ml
gid://shopify/Product/9272372920662,isseymiyake-fusion-dissey-igo-eau-de-toilette-spray-20ml,Issey Miyake Fusion D'Issey IGO Perfume Spray - 20ml
gid://shopify/Product/9272373379414,moschino-women-eau-de-toilette-spray-75ml,Moschino Women's Eau De Toilette Spray 75ml
gid://shopify/Product/9272373641558,calvin-klein-truth-men-eau-de-toilette-spray-100ml,Calvin Klein Truth Men Eau De Toilette Spray 100ml
gid://shopify/Product/9272373870934,abercrombie-fitch-naturally-fierce-eau-de-parfum-spray-100ml,Abercrombie & Fitch Naturally Fierce EDP - 100ml
gid://shopify/Product/9272374165846,boucheron-pour-homme-eau-de-toilette-spray-100ml,Boucheron Pour Homme Eau de Toilette Spray - 100ml
gid://shopify/Product/9272374427990,jil-sander-sunset-eau-de-parfum-spray-75ml,Jil Sander Sunset Eau De Parfum Spray - 75ml
gid://shopify/Product/9272374690134,elizabeth-arden-white-tea-body-cream-400ml,Shop Elizabeth Arden White Tea Body Cream - Luxurious 400ml Size
gid://shopify/Product/9272375050582,karl-lagerfeld-hamburg-alster-eau-de-toilette-spray-60ml,Karl Lagerfeld Hamburg Alster EDT Spray 60ml
gid://shopify/Product/9272375279958,burberry-original-women-eau-de-parfum-spray-50ml,Burberry Original Women's Eau de Parfum Spray 50ml
gid://shopify/Product/9272375574870,hugo-just-different-eau-de-toilette-spray-40ml,Hugo Just Different Eau De Toilette Spray - 40ml
gid://shopify/Product/9272375804246,moschino-pink-bouquet-eau-de-toilette-spray-100ml-by-moschino,Shop Moschino Pink Bouquet Eau De Toilette Spray 100ml
gid://shopify/Product/9272376033622,isseymiyake-drop-dissey-eau-de-parfum-spray-50ml,Issey Miyake A Drop d'Issey Eau De Parfum Spray - 50ml
gid://shopify/Product/9272376328534,cerruti-1881-pour-homme-eau-de-toilette-spray-25ml,Cerruti 1881 Pour Homme Eau De Toilette 25ml - Authentic Fragrance for Men
gid://shopify/Product/9272376492374,paloma-picasso-eau-de-toilette-spray-50ml,Paloma Picasso Eau de Toilette 50ml Spray
gid://shopify/Product/9272376688982,isseymiyake-leau-dissey-eau-de-toilette-spray-40ml,Issey Miyake L'eau D'issey Eau De Toilette Spray - 40ml
gid://shopify/Product/9272376918358,hugo-boss-ma-vie-leau-pour-femme-eau-de-toilette-spray-50ml,Hugo Boss Ma Vie L'Eau Pour Femme EDT Spray 50ml
gid://shopify/Product/9272377114966,antonio-banderas-power-seduction-eau-toilette-spray-100ml,Antonio Banderas Power of Seduction Eau De Toilette Spray - 100ml
gid://shopify/Product/9272377475414,burberry-weekend-men-eau-de-toilette-spray-50ml,Burberry Weekend Men's Eau de Toilette Spray - 50ml
gid://shopify/Product/9272377737558,davidoff-cool-water-eau-de-toilette-spray-75ml,Daviwoff Cool Water 75ml Eau De Toilette Spray
gid://shopify/Product/9272378032470,mont-blanc-starwalker-eau-de-toilette-spray-75ml,Mont Blanc Starwalker Eau De Toilette Spray - 75ml
gid://shopify/Product/9272378229078,aramis-aramis-eau-toilette-spray-110ml,Aramis Eau De Toilette Spray 110ml
gid://shopify/Product/9272378458454,lacoste-l1212-pour-elle-sparkling-eau-de-toilette-spray-30ml,Lacoste L.12.12 Pour Elle Sparkling Eau De Toilette Spray - 30ml
gid://shopify/Product/9272378753366,lacoste-match-point-cologne-eau-de-toilette-spray-100ml,Lacoste Match Point Cologne Eau De Toilette Spray - 100ml
gid://shopify/Product/9272379048278,versace-red-jeans-eau-de-toilette-spray-75ml,Versace Red Jeans Eau De Toilette Spray 75ml
gid://shopify/Product/9272379277654,dkny-golden-delicious-eau-de-parfum-spray-50ml,DKNY Golden Delicious Eau De Parfum 50ml Spray
gid://shopify/Product/9272379539798,hollister-festival-nite-him-eau-de-toilette-spray-100ml,Hollister Festival Nite Eau De Toilette Spray 100ml - Men's Fragrance
gid://shopify/Product/9272379834710,karl-lagerfeld-classic-grey-eau-de-toilette-spray-100ml,Karl Lagerfeld Classic Grey Eau De Toilette Spray - 100ml
gid://shopify/Product/9272380096854,calvin-klein-euphoria-eau-de-parfum-spray-30ml,Calvin Klein Euphoria 30ml Eau De Parfum Spray
gid://shopify/Product/9272380490070,abercrombie-fitch-first-instinct-together-for-her-eau-de-parfum-spray-100ml,Abercrombie & Fitch First Instinct Together Eau De Parfum Spray 100ml
gid://shopify/Product/9272380817750,gres-cabotine-eau-de-toilette-spray-100ml,Gres Cabotine Eau De Toilette Spray - 100ml
gid://shopify/Product/9272381276502,karl-lagerfeld-paris-rue-saint-guillaume-eau-de-parfum-spray-60ml,Karl Lagerfeld Paris 21 Rue Saint-Guillaume Eau de Parfum Spray 60ml
gid://shopify/Product/9272381604182,elizabeth-arden-blue-grass-eau-de-parfum-spray-100ml,Elizabeth Arden Blue Grass Perfume Spray - 100ml
gid://shopify/Product/9272381964630,lanvin-lhomme-eau-de-toilette-spray-100ml,Lanvin L'homme Eau De Toilette Spray - 100ml
gid://shopify/Product/9272382554454,esteelauder-sensuous-eau-de-parfum-spray-50ml,Estee Lauder Sensuous Eau De Parfum 50ml Spray
gid://shopify/Product/9272382783830,boucheron-jaipur-bracelet-eau-de-parfum-spray-100ml,Boucheron Jaipur Bracelet Eau De Parfum - 100ml Spray
gid://shopify/Product/9272383144278,davidoff-coolwater-men-intense-eau-de-parfum-spray-75ml,Davidoff Coolwater Men Intense Eau de Parfum Spray 75ml
gid://shopify/Product/9272383340886,acqua-di-parma-mirto-di-panarea-roller-ball-eau-de-toilette-10ml,Acqua Di Parma Mirto Di Panarea Roller Ball Eau De Toilette - 10ml
gid://shopify/Product/9272383734102,issey-miyake-leau-dissey-pour-femme-eau-de-toilette-spray-25ml,Issey Miyake L'eau D'issey Pour Femme Eau De Toilette Spray - 25ml
gid://shopify/Product/9272384127318,britney-spears-curious-eau-de-parfum-spray-100ml,Britney Spears Curious Eau De Parfum Spray - 100ml
gid://shopify/Product/9272384323926,britney-spears-intimate-fantasy-eau-de-parfum-spray-100ml,Britney Spears Intimate Fantasy Perfume Spray 100ml
gid://shopify/Product/9272384553302,jaguar-classic-gold-eau-de-toilette-spray-100ml,Jaguar Classic Gold EDT Spray 100ml
gid://shopify/Product/9272384880982,diesel-bad-eau-de-toilette-spray-50ml,Diesel Bad 50ml Eau De Toilette Spray
gid://shopify/Product/9272385044822,tommy-men-eau-de-toilette-spray-50ml,Tommy Men Eau De Toilette 50ml Spray
gid://shopify/Product/9272385241430,lalique-encre-noire-sport-eau-de-toilette-spray-100ml,Lalique Encre Noire Sport EDT Spray 100ml
gid://shopify/Product/9272385405270,isseymiyake-drop-dissey-essentielle-eau-de-parfum-spray-50ml,Issey Miyake A Drop D'issey Essentielle Eau De Parfum 50ml Spray
gid://shopify/Product/9272385634646,pierre-cardin-eau-de-cologne-spray-80ml,Pierre Cardin 80ml Eau de Cologne Spray
gid://shopify/Product/9272385765718,nina-ricci-nina-deodorant-spray-150ml,Nina Ricci Nina Deodorant Spray - 150ml
gid://shopify/Product/9272386027862,elizabeth-arden-red-door-eau-de-toilette-spray-100ml,Elizabeth Arden Red Door Eau De Toilette Spray - 100ml
gid://shopify/Product/9272386322774,calvin-klein-free-men-eau-de-toilette-spray-100ml,Calvin Klein Free Men Eau De Toilette Spray 100ml | Buy Online Now
gid://shopify/Product/9272386519382,versace-man-eau-fraiche-eau-de-toilette-spray-30ml,Versace Man Eau Fraiche 30ml Eau De Toilette Spray
gid://shopify/Product/9272386847062,abercrombie-fitch-authentic-moment-woman-eau-de-parfum-spray-100ml,Abercrombie & Fitch Authentic Moment Woman Eau De Parfum 100ml
gid://shopify/Product/9272387109206,britney-spears-hidden-fantasy-eau-de-parfum-spray-100ml,Britney Spears Hidden Fantasy Perfume Spray 100ml
gid://shopify/Product/9272387404118,elizabeth-arden-fifth-avenue-eau-de-parfum-spray-125ml,Elizabeth Arden Fifth Avenue Perfume 125ml Spray
gid://shopify/Product/9272387633494,jovan-musk-aftershave-236ml,Jovan Musk Aftershave - 236ml Bottle
gid://shopify/Product/9272387862870,jimmy-choo-illicit-eau-de-parfum-spray-40ml,Jimmy Choo Illicit Eau de Parfum Spray - 40ml
gid://shopify/Product/9272388321622,estee-lauder-pleasures-eau-de-cologne-100ml-estee-lauder-pleasures-eau-de-cologne-100ml,Estee Lauder Pleasures Eau De Cologne - 100ml
gid://shopify/Product/9272388813142,police-to-be-woman-eau-de-parfum-spray-125ml,Police Woman Eau de Parfum Spray 125ml
gid://shopify/Product/9272389271894,montblanc-legend-spirit-eau-de-toilette-spray-30ml,Montblanc Legend Spirit 30ml Eau de Toilette Spray
gid://shopify/Product/9272389665110,giorgio-beverly-hills-yellow-eau-de-toilette-spray-90ml,Giorgio Beverly Hills Yellow EDT Spray 90ml
gid://shopify/Product/9272390091094,calvin-klein-ck-be-deodorant-stick-75g,Calvin Klein CK Be 75g Deodorant Stick
gid://shopify/Product/9272390517078,elizabeth-arden-green-tea-honey-drops-body-cream-500ml,Elizabeth Arden Green Tea Honey Drops Body Cream - 500ml
gid://shopify/Product/9272390811990,isseymiyake-leaudisseypourhommesport-homme-eaudetoilettespray-50ml,Issey Miyake L'Eau D'Issey Pour Homme Sport 50ml Eau de Toilette Spray
gid://shopify/Product/9272391172438,elizabeth-arden-true-love-eau-de-toilette-spray-100ml,Elizabeth Arden True Love Eau De Toilette Spray - 100ml
gid://shopify/Product/9272391532886,britney-spears-blissful-fantasy-eau-de-toilette-spray-100ml,Britney Spears Blissful Fantasy Eau De Toilette Spray - 100ml
gid://shopify/Product/9272391696726,calvin-klein-one-deodorant-stick-75ml,Calvin Klein One 75ml Deodorant Stick
gid://shopify/Product/9272392024406,david-beckham-instinct-eau-de-toilette-spray-30ml,David Beckham Instinct Eau De Toilette Spray - 30ml
gid://shopify/Product/9272392319318,sarah-jessica-parker-lovely-eau-de-parfum-spray-100ml,SJP Lovely Eau De Parfum Spray 100ml
gid://shopify/Product/9272392548694,diesel-bad-body-spray-200ml,Diesel Bad Body Spray - 200ml
gid://shopify/Product/9272392646998,lalique-amethyst-eau-de-parfum-spray-100ml,Lalique Amethyst 100ml Eau De Parfum Spray
gid://shopify/Product/9272392941910,jennifer-lopez-live-eau-de-parfum-spray-100ml,Jennifer Lopez Live Eau De Parfum 100ml Spray
gid://shopify/Product/9272393040214,dsquared2-red-wood-pour-femme-eau-de-toilette-spray-100ml,Dsquared2 Red Wood Pour Femme Eau De Toilette 100ml Spray
gid://shopify/Product/9272393171286,isseymiyake-leau-dissey-shades-kolam-eau-toilette-spray-100ml,Issey Miyake L'eau D'issey Shades Of Kolam 100ml Eau De Toilette Spray
gid://shopify/Product/9272393400662,elizabeth-arden-green-tea-lavender-eau-de-toilette-spray-100ml,Elizabeth Arden Green Tea Lavender EDT Spray - 100ml
gid://shopify/Product/9272393597270,anna-sui-sky-eau-de-toilette-spray-75ml,Anna Sui Sky Eau De Toilette 75ml Spray
gid://shopify/Product/9272393761110,ck-obsession-eau-de-parfum-spray-100ml,CK OBSESSION Eau De Parfum 100ML Spray
gid://shopify/Product/9272393859414,calvin-klein-one-shock-for-him-eau-de-toilette-spray-100ml,Calvin Klein One Shock Men's Eau De Toilette Spray - 100ML
gid://shopify/Product/9272394056022,davidoff-cool-water-oceanic-edition-woman-eau-de-toilette-spray-100ml,Davidoff Cool Water Oceanic Edition Women's Eau De Toilette Spray 100ml
gid://shopify/Product/9272394416470,katy-perry-purr-eau-de-parfum-spray-100ml,Katy Perry Purr Perfume Spray - 100ml
gid://shopify/Product/9272394580310,calvin-klein-eternity-for-men-hair-body-wash-200ml,Calvin Klein Eternity Men Hair & Body Wash 200ml
gid://shopify/Product/9272394842454,police-king-eau-de-toilette-spray-40ml,Police King Eau De Toilette Spray 40ml
gid://shopify/Product/9272395039062,lacoste-match-point-cologne-eau-de-toilette-spray-50ml,Lacoste Match Point Eau De Toilette Spray 50ml
gid://shopify/Product/9272395333974,sarah-jessica-parker-lovely-eau-de-parfum-spray-200ml,Sarah Jessica Parker Lovely Eau de Parfum Spray
gid://shopify/Product/9272395530582,tommy-men-eau-de-toilette-spray-30ml,Tommy Men Eau De Toilette Spray - 30ml
gid://shopify/Product/9272395792726,abercombie-fitch-first-instinct-extreme-eau-de-parfum-spray-100ml,Abercrombie & Fitch First Instinct Extreme 100ml Eau De Parfum Spray
gid://shopify/Product/9272395956566,calvin-klein-truth-eau-de-parfum-spray-100ml,Calvin Klein Truth Perfume Spray - 100ml Bottle
gid://shopify/Product/9272396185942,james-bond-007-cologne-spray-30ml,James Bond 30ml Cologne Spray
gid://shopify/Product/9272396382550,issey-miyake-leau-dissey-pour-homme-deodorant-stick-75ml,Issey Miyake L'Eau d'Issey Pour Homme Deodorant Stick 75ml
gid://shopify/Product/9272396677462,jimmy-choo-eau-de-toilette-spray-60ml,Jimmy Choo 60ml Eau de Toilette Spray
gid://shopify/Product/9272396906838,jimmy-choo-man-eau-de-toilette-spray-50ml,Jimmy Choo Man 50ml Eau De Toilette Spray
gid://shopify/Product/9272397136214,moschino-uomo-eau-de-toilette-spray-125ml,Moschino Uomo EDT Spray 125ml
gid://shopify/Product/9272397398358,karl-lagerfeld-rome-divono-amore-eau-de-parfum-spray-60ml,Karl Lagerfeld Rome Divono Amore Eau De Parfum 60ml Spray
gid://shopify/Product/9272397627734,guy-laroche-drakkar-noir-men-eau-de-toilette-spray-100ml,Guy Laroche Drakkar Noir Men Eau De Toilette Spray - 100ml
gid://shopify/Product/9272397889878,elizabeth-arden-fifth-avenue-eau-de-parfum-spray-30ml,Elizabeth Arden Fifth Avenue Eau De Parfum 30ml Spray
gid://shopify/Product/9272398381398,calvin-klein-ck-one-gold-eau-de-toilette-spray-100ml,Calvin Klein CK One Gold 100ml Eau De Toilette Spray
gid://shopify/Product/9272398971222,jovan-white-musk-cologne-spray-88ml,Jovan White Musk Cologne Spray - 88ml
gid://shopify/Product/9272399364438,escada-brisa-cubana-eau-de-toilette-spray-limited-edition-100ml,Escada Brisa Cubana Eau De Toilette Limited Edition 100ml Spray
gid://shopify/Product/9272399495510,mont-blanc-explorer-platinum-eau-de-parfum-spray-30ml,Mont Blanc Explorer Platinum EDP Spray 30ml
gid://shopify/Product/9272399692118,abercrombie-fitch-first-instinct-eau-de-toilette-spray-100ml,Abercrombie & Fitch First Instinct Eau De Toilette Spray - 100ml
gid://shopify/Product/9272400216406,elizabeth-arden-white-tea-eau-de-toilette-spray-100ml,Elizabeth Arden White Tea Eau de Toilette Spray - 100ml
gid://shopify/Product/9272400740694,laura-biagiotti-laura-eau-de-toilette-spray-50ml,Laura Biagiotti Laura Eau De Toilette Spray - 50ml
gid://shopify/Product/9272401297750,ralph-lauren-polo-sport-fresh-men-eau-de-toilette-spray-125ml,Ralph Lauren Polo Sport Fresh Men's Eau De Toilette Spray 125ml
gid://shopify/Product/9272401920342,boucheron-place-vendome-eau-de-parfum-spray-100ml,Boucheron Place Vendome 100ml Eau de Parfum Spray
gid://shopify/Product/9272402510166,calvin-klein-ck-all-eau-de-toilette-spray-200ml,Calvin Klein CK All 200ml Eau De Toilette Spray - Shop Now!
gid://shopify/Product/9272403067222,burberry-men-eau-toilette-spray-50ml,Burberry Men's Eau De Toilette Spray - 50ml
gid://shopify/Product/9272403624278,hugo-boss-hugo-reversed-eau-de-toilette-spray-75ml,Hugo Boss Hugo Reversed Eau De Toilette Spray - 75ml
gid://shopify/Product/9272404279638,gres-cabotine-eau-de-parfum-spray-100ml,Gres Cabotine Eau De Parfum Spray - 100ml
gid://shopify/Product/9272405000534,lanvin-arpege-eau-de-parfum-spray-100ml,Lanvin Arpege Eau De Parfum Spray - 100ml
gid://shopify/Product/9272405590358,calvin-klein-obsession-for-men-deodorant-stick-75ml,Calvin Klein Obsession Men Deodorant Stick 75ml
gid://shopify/Product/9272406344022,giorgio-beverly-hills-wings-men-eau-de-toilette-spray-100ml,Giorgio Beverly Hills Wings Men's Eau De Toilette Spray 100ml
gid://shopify/Product/9272407261526,britney-spears-fantasy-eau-de-parfum-spray-100ml,Britney Spears Fantasy Eau de Parfum 100ml Spray
gid://shopify/Product/9272408146262,diesel-only-the-brave-eau-de-toilette-spray-50ml,Diesel Only The Brave Eau De Toilette Spray - 50ml
gid://shopify/Product/9272408310102,lacoste-l1212-pour-elle-french-panache-eau-toilette-spray-90ml,Lacoste L.12.12 Pour Elle French Panache EDT Spray 90ml
gid://shopify/Product/9272408637782,calvin-klein-beauty-eau-de-parfum-spray-100ml,Calvin Klein Beauty Eau de Parfum Spray - 100ml Bottle
gid://shopify/Product/9272408998230,britney-spears-fantasy-intense-eau-de-parfum-spray-100ml,Britney Spears Fantasy Intense 100ml Eau De Parfum Spray
gid://shopify/Product/9272409129302,paco-invictus-deo-stick-75ml,Paco Invictus Deo Stick - 75ml
gid://shopify/Product/9272409391446,davidoff-cool-water-deodorant-spray-150ml,Davidoff Cool Water Deodorant Spray - 150ml
gid://shopify/Product/9272409588054,lacoste-essential-eau-de-toilette-spray-75ml,LACOSTE ESSENTIAL Eau De Toilette 75ML Spray
gid://shopify/Product/9272409850198,jaguar-men-eau-de-toilette-spray-100ml,Jaguar Men's Eau De Toilette Spray - 100ml
gid://shopify/Product/9272410079574,britney-spears-fantasy-sheer-eau-de-toilette-spray-100ml,Britney Spears Fantasy Sheer Eau De Toilette Spray - 100ml
gid://shopify/Product/9272410341718,jaguar-classic-red-eau-de-toilette-spray-100ml,Jaguar Classic Red Eau De Toilette Spray - 100ml
gid://shopify/Product/9272410702166,britney-spears-believe-eau-de-parfum-spray-100ml,Britney Spears Believe Perfume 100ml Spray
gid://shopify/Product/9272411062614,elizabeth-arden-white-tea-eau-florale-eau-de-toilette-spray-100ml,Elizabeth Arden White Tea Eau Florale Eau De Toilette Spray - 100ml
gid://shopify/Product/9272411488598,christina-aguilera-violet-noir-eau-de-parfum-spray-50ml,Christina Aguilera Violet Noir Eau De Parfum 50ml Spray
gid://shopify/Product/9272411750742,lacoste-l12-12-rose-eau-intense-eau-de-toilette-spray-50ml,Lacoste L.12.12 Rose Intense Eau De Toilette Spray - 50ml
gid://shopify/Product/9272412078422,azzaro-homme-deodorant-spray-150ml,Azzaro Homme Deodorant Spray - 150ml
gid://shopify/Product/9272412471638,davidoff-cool-water-woman-eau-de-toilette-spray-30ml,Davidoff Cool Water Woman EDT Spray 30ml
gid://shopify/Product/9272413126998,police-to-be-eau-de-toilette-spray-125ml,Police Eau De Toilette Spray 125ml
gid://shopify/Product/9272413651286,britney-spears-midnight-fantasy-eau-de-parfum-spray-100ml,Britney Spears Midnight Fantasy Perfume - 100ml Spray
gid://shopify/Product/9272413847894,esteelauder-pleasures-eau-de-parfum-spray-30ml,Estee Lauder Pleasures Eau de Parfum Spray - 30ml
gid://shopify/Product/9272414077270,elizabeth-arden-green-tea-eau-de-parfum-spray-50ml,Elizabeth Arden Green Tea Eau de Parfum Spray - 50ml
gid://shopify/Product/9272414437718,giorgio-beverly-hills-red-men-eau-de-toilette-spray-100ml,Giorgio Beverly Hills Red Men's Eau De Toilette Spray 100ml
gid://shopify/Product/9272414765398,dolce-gabbana-light-blue-pour-homme-eau-de-toilette-spray,Dolce & Gabbana Light Blue Men's Eau de Toilette Spray
gid://shopify/Product/9272415027542,calvin-klein-everyone-eau-de-toilette-spray-10ml,Calvin Klein Everyone 10ml Eau De Toilette Spray
gid://shopify/Product/9272415355222,elizabeth-arden-always-red-femme-eau-de-toilette-spray-100ml,Elizabeth Arden Always Red Femme Eau De Toilette 100ml
gid://shopify/Product/9272415945046,jimmy-choo-floral-eau-de-toilette-spray-40ml,Jimmy Choo Floral Eau de Toilette Spray - 40ml
gid://shopify/Product/9272416469334,lanvin-rumeur-eau-de-parfum-spray-100ml,Lanvin Rumeur Eau De Parfum Spray - 100ml
gid://shopify/Product/9272417419606,lalique-encre-noire-eau-de-toilette-spray-100ml,Lalique Encre Noire Eau De Toilette 100ml Spray
gid://shopify/Product/9272417976662,versace-woman-eau-de-parfum-spray,Versace Woman Eau de Parfum Spray - Authentic Designer Fragrance
gid://shopify/Product/9272418435414,dkny-golden-delicious-eau-de-parfum-spray-100ml,DKNY Golden Delicious Eau De Parfum Spray - 100ml
gid://shopify/Product/9272418795862,calvin-klein-ck-all-eau-de-toilette-spray-100ml,Calvin Klein CK All 100ml Toilette Spray - Buy Now!
gid://shopify/Product/9272419123542,calvin-klein-ck-one-shock-for-her-eau-de-toilette-spray-200ml,Calvin Klein CK One Shock Eau De Toilette Spray 200ml
gid://shopify/Product/9272419451222,calvin-klein-man-eau-de-toilette-spray-100ml,Calvin Klein Man Eau De Toilette 100ml Spray
gid://shopify/Product/9272420073814,clinique-happy-eau-de-parfum-spray-30ml,Authentic Clinique Happy 30ml Eau De Parfum Spray - Buy Now!
gid://shopify/Product/9272420303190,montblanc-legend-eau-de-toilette-spray-30ml,Montblanc Legend 30ml EDT Spray
gid://shopify/Product/9272420532566,lacoste-match-point-eau-de-parfum-spray-30ml,Lacoste Match Point Eau de Parfum 30ml Spray
gid://shopify/Product/9272420696406,burberry-weekend-for-men-eau-de-toilette-spray-30ml,Burberry Weekend Men's Eau de Toilette Spray - 30ml
gid://shopify/Product/9272420925782,diesel-only-brave-street-eau-de-toilette-spray-35ml,Diesel Only The Brave Street Eau De Toilette Spray - 35ml
gid://shopify/Product/9272421056854,jimmy-choo-man-blue-eau-de-toilette-spray-30ml,Jimmy Choo Man Blue EDT Spray 30ml
gid://shopify/Product/9272421351766,jimmy-choo-leau-eau-de-toilette-spray-60ml,Jimmy Choo L'eau Eau de Toilette Spray - 60ml
gid://shopify/Product/9272421548374,hugo-boss-orange-woman-eau-de-toilette-50ml,Hugo Boss Boss Orange Woman Eau De Toilette Spray - 50ml
gid://shopify/Product/9272421777750,hugo-boss-woman-extreme-eau-de-parfum-spray-75ml,Hugo Boss Boss Woman Extreme Eau De Parfum 75ml Spray
gid://shopify/Product/9272421941590,isseymiyake-fusion-eau-de-toilette-spray-50ml,Issey Miyake Fusion EDT Spray 50ml
gid://shopify/Product/9272422170966,calvin-klein-eternity-flame-men-eau-de-toilette-spray-100ml,Calvin Klein Eternity Flame Men Eau de Toilette Spray 100ml
gid://shopify/Product/9272422367574,moschino-uomo-eau-de-toilette-spray-75ml,Moschino Uomo Eau de Toilette Spray - 75ml
gid://shopify/Product/9272422662486,montblanc-presence-eau-de-toilette-spray-75ml,Montblanc Presence Eau de Toilette 75ml Spray
gid://shopify/Product/9272422859094,montblanc-explorer-eau-de-parfum-spray-30ml,Montblanc Explorer Eau De Parfum 30ml Spray
gid://shopify/Product/9272423219542,miu-miu-serial-player-eau-de-toilette-spray-50ml,Miu Miu Serial Player Eau De Toilette Spray - 50ml
gid://shopify/Product/9272423448918,rabanne-1-million-deodorant-stick-75ml,Paco Rabanne 1 Million Deodorant Stick
gid://shopify/Product/9272423711062,joop-fragranced-deodorant-spray-75ml,Joop Fragranced Deodorant Spray - 75ml
gid://shopify/Product/9272424300886,elizabeth-arden-pretty-eau-de-parfum-spray-100ml,Elizabeth Arden Pretty Eau de Parfum Spray - 100ml
gid://shopify/Product/9272424530262,moschino-pink-bouquet-eau-de-toilette-spray-50ml,Shop Moschino Pink Bouquet Eau De Toilette Spray - 50ml
gid://shopify/Product/9272424694102,issey-miyake-vetiver-eau-de-toilette-spray-50ml,Issey Miyake Vetiver Eau De Toilette 50ml Spray
gid://shopify/Product/9272425218390,cacharel-amor-amor-eau-de-toilette-spray-50ml,Cacharel Amor Amor 50ml Eau De Toilette Spray
gid://shopify/Product/9272425578838,versace-lhomme-eau-de-toilette-spray-100ml,Versace L'Homme Eau De Toilette Spray - 100ml
gid://shopify/Product/9272425677142,moschino-funny-eau-de-toilette-spray-50ml,Shop Moschino Funny 50ml Eau de Toilette Spray Online
gid://shopify/Product/9272425939286,abercrombie-fitch-authentic-man-eau-de-toilette-spray-30ml,Abercrombie & Fitch Authentic Man Eau de Toilette Spray - 30ml
gid://shopify/Product/9272426103126,calvin-klein-eternity-moment-eau-de-parfum-spray-50ml,Calvin Klein Eternity Moment EDP Spray 50ml
gid://shopify/Product/9272426496342,davidoff-game-eau-de-toilette-spray-100ml,Davidoff The Game 100ml Eau de Toilette Spray
gid://shopify/Product/9272426987862,sarah-jessica-parker-lovely-eau-de-parfum-spray-50ml,SJP Lovely Eau de Parfum Spray 50ml
gid://shopify/Product/9272427250006,jpg-scandal-shower-gel-150ml,JPG Scandal Shower Gel - 150ml
gid://shopify/Product/9272427413846,jennifer-lopez-miami-glow-eau-de-toilette-spray-100ml,Jennifer Lopez Miami Glow 100ml Eau de Toilette Spray
gid://shopify/Product/9272427872598,cacharel-eden-eau-de-parfum-spray-30ml,Cacharel Eden Eau de Parfum 30ml Spray
gid://shopify/Product/9272428101974,calvin-klein-eternity-men-eau-de-toilette-spray-30ml,Calvin Klein Eternity Men Eau De Toilette Spray 30ml
gid://shopify/Product/9272428429654,ralph-lauren-polo-sport-eau-de-toilette-75ml,Ralph Lauren Polo Sport Eau de Toilette Spray - 75ml
