Id,Handle,Title
gid://shopify/Product/9272323703126,6-packets-satya-superhit-backflow-dhoop-cones,6 Packets Satya Superhit Backflow Dhoop Cones
gid://shopify/Product/9272323834198,satya-rose-backflow-dhoop-cones-6-packets,Satya Rose Backflow Dhoop Cones - Set of 6 Packets
gid://shopify/Product/9272323965270,hanging-bathroom-kitchen-sink-tidy-box-hot-rag-storage-rack-beige,Hanging Bathroom and Kitchen Sink Tidy Box Hot Rag Storage Rack - Beige
gid://shopify/Product/9272324096342,aquarius-key-finder-anti-lost-alarm-gps-last-location-finder-gold,Aquarius Key Finder Anti-Lost Alarm GPS Last Location Finder Gold
gid://shopify/Product/9272324227414,holy-basil-tulsi-powder,Organic Holy Basil Powder - Pure Tulsi for Natural Wellness
gid://shopify/Product/9272324424022,neem-margosa-powder,Organic Neem Powder for Natural Health and Beauty
gid://shopify/Product/9272324522326,lauki-capsule-bottle-gourd,Lauki Capsule - Organic Bottle Gourd Supplement
gid://shopify/Product/9272324686166,amba-haldi-curcuma-amada-powder,Amba Haldi Powder - Buy Premium Curcuma Amada Online
gid://shopify/Product/9272324882774,majuphal-katalu-mayu-powder,Majuphal (Katalu Mayu) Powder - Pure and Potent Herbal Supplement
gid://shopify/Product/9272325112150,harde-haritaki-capsule,Organic Harde (Haritaki) Capsule - Natural Digestive Support
gid://shopify/Product/9272325275990,jamun-karela-powder,Organic Jamun Karela Powder
gid://shopify/Product/9272325472598,senna-leaf-capsule-cassia-angustifolia,Senna Leaf Capsule - Cassia Angustifolia Supplement
gid://shopify/Product/9272325800278,jambu-bij-capsule-jamun-beej-syzygium-cumini-supports-sugar,Organic Jambu Bij Capsule - Natural Support for Sugar Balance
gid://shopify/Product/9272326029654,swadista-virechan-powder,Swadista Virechan Herbal Powder - Natural Detox Cleanse
gid://shopify/Product/9272326291798,caralluma-fimbriata-capsule,Organic Caralluma Fimbriata Capsules
gid://shopify/Product/9272326455638,karneem-karela-neem-capsule,KarNeem Capsule - Natural Karela and Neem Supplement
gid://shopify/Product/9272326619478,wheat-grass-powder-benefits,Wheat Grass Powder: Organic Superfood Boost
gid://shopify/Product/9272326914390,harad-haritaki-powder,Organic Harad (Haritaki) Powder - Pure and Natural
gid://shopify/Product/9272327110998,neem-margosa-capsule,Organic Neem Capsules
gid://shopify/Product/9272327340374,bitter-gourd-karela-powder,Bitter Gourd Karela Powder - Organic & Pure
gid://shopify/Product/9272327471446,noni-black-pepper-capsule,Organic Noni Black Pepper Capsule
gid://shopify/Product/9272327668054,shankpushpi-powder-benefits,Organic Shankpushpi Powder - Boost Your Memory and Focus Naturally
gid://shopify/Product/9272327799126,giloy-guduchi-capsule-tinospora-cordifolia,Giloy Guduchi Capsule - Boost Your Immunity Naturally
gid://shopify/Product/9272328061270,liquorice-root-capsule-yastimadhu-mulethi-jethimadh,Liquorice Root Capsule - Yastimadhu Mulethi Jethimadh
gid://shopify/Product/9272328225110,brahmi-powder-benefits-or-simply-brahmi-powder,Brahmi Powder - Natural Cognitive Enhancer
gid://shopify/Product/9272328356182,spirulina-powder-benefits,Spirulina Powder - Shop the Best Quality Online Now!
gid://shopify/Product/9272328520022,aloe-vera-capsule-support-colon-cleanse-detox,Aloe Vera Capsule for Colon Cleanse and Detox Support
gid://shopify/Product/9272328749398,moringa-oleifera-drumstick-powder,Organic Moringa Oleifera Powder - Pure and Nutritious Superfood
gid://shopify/Product/9272328978774,turmeric-ginger-black-pepper-capsule,Organic Turmeric Fusion Capsule with Ginger and Black Pepper - Natural Health Boost
gid://shopify/Product/9272329175382,ashwagandha-capsule,Premium Ashwagandha Capsules: Boost Your Wellness Naturally
gid://shopify/Product/9272329339222,bibhitaki-fruit-powder,Bibhitaki Fruit Powder: Natural Health Supplement
gid://shopify/Product/9272329470294,neem-tulsi-capsule,Organic Neem Tulsi Capsules
gid://shopify/Product/9272329634134,shilajit-capsule-immune-support,Premium Shilajit Capsules for Immune Support
gid://shopify/Product/9272329797974,fenugreek-capsule-benefits,Fenugreek Capsule - Natural Supplement for Health and Wellness
gid://shopify/Product/9272330027350,kali-jiri-mixture-powder,Organic Kali Jiri Powder Blend - Natural Health Supplement
gid://shopify/Product/9272330256726,rose-petals-powder-natural-coolant-skin-body,Organic Rose Petals Powder: Skin & Body Coolant
gid://shopify/Product/9272330387798,amla-fruit-gooseberry-powder,Amla Fruit Powder - Natural Gooseberry Supplement
gid://shopify/Product/9272330551638,measure-me-capsule,Measuring Capsule - Essential Tool for Precision Measurement
gid://shopify/Product/9272330781014,pure-himalayan-shilajit-powder-fulvic-acid-humic-acid-minerals-3-5-oz-100g,Himalayan Shilajit Powder with Fulvic Acid/Humic Acid and Minerals - 3.5 oz
gid://shopify/Product/9272330944854,pure-guggul-capsule,Organic Guggul Capsule - Ultimate Wellness Boost
gid://shopify/Product/9272331075926,jamun-karela-capsule,Organic Jamun Karela Capsules: Boost Your Wellness naturally
gid://shopify/Product/9272331272534,rasayana-powder-benefits,Organic Rasayana Powder - Ayurvedic Herbal Supplement
gid://shopify/Product/9272331469142,holy-basil-tulsi-capsule,Holy Basil Tulsi Capsule
gid://shopify/Product/9272331731286,tribulus-terrestris-extract-capsules,Tribulus Terrestris Extract Capsules - Natural Testosterone Booster
gid://shopify/Product/9272331960662,bitter-gourd-karela-capsule,Bitter Gourd (Karela) Capsules - Natural Supplement for Health
gid://shopify/Product/9272332124502,green-coffee-bean-capsule,Organic Green Coffee Bean Capsule
gid://shopify/Product/9272332353878,maca-root-capsule,Maca Root Capsule Supplement
gid://shopify/Product/9272332517718,hingvastak-powder-benefits,Hingvastak Powder - Ayurvedic Digestive Support Blend
gid://shopify/Product/9272332714326,dia-care-capsule,Dia Care Capsule - Natural Supplement for Blood Sugar Support
gid://shopify/Product/9272332943702,pure-bhringraj-powder,Pure Bhringraj Powder - Natural Hair Care Solution
gid://shopify/Product/9272333238614,mucuna-pruriens-powder-benefits,Mucuna Pruriens Organic Powder - Boost Your Well-being Naturally
gid://shopify/Product/9272333533526,curcumin-turmeric-capsule-piperine,Premium Curcumin Turmeric Capsules with Piperine
gid://shopify/Product/9272333697366,ginger-root-sunthi-capsule,Ginger Root (Sunthi) Capsule - Organic and Natural Supplement
gid://shopify/Product/9272334025046,brahmi-capsule-natural-brain-support,Brahmi Capsule - Natural Brain Support Supplement
gid://shopify/Product/9272334319958,bilva-bael-leaf-capsule,Bilva (Bael Leaf) Capsule - Organic Herbal Supplement
gid://shopify/Product/9272334582102,amla-fruit-gooseberry-capsule,Organic Amla Gooseberry Capsule
gid://shopify/Product/9272334745942,ayush-kwath-natural-support-immune-system,Ayush Kwath Immune System Support Herbal Supplement
gid://shopify/Product/9272334975318,mucuna-pruriens-capsule,Mucuna Pruriens Supplement Capsules
gid://shopify/Product/9272335171926,gotu-kola-capsule-centella-asiatica,Pure Gotu Kola Capsules - Centella asiatica Supplement
gid://shopify/Product/9272335335766,garcinia-cambogia-capsule,Garcinia Cambogia Capsule - Natural Weight Loss Supplement
gid://shopify/Product/9272335401302,manjishtha-capsule-rubia-cordifolia-ayurvedic-purifier,Organic Manjishtha Capsule with Rubia Cordifolia - Ayurvedic Purifier
gid://shopify/Product/9272335499606,ashoka-bark-powder-saraca-asoca,Ashoka Bark Powder - Saraca Asoca Herbal Supplement
gid://shopify/Product/9272335696214,trikatu-capsule-respiratory-support,Trikatu Capsule for Respiratory Support
gid://shopify/Product/9272335860054,triphala-capsule-amla-behada-harada,Organic Triphala Capsule with Amla/ Behada & Harada
gid://shopify/Product/9272336056662,black-cumin-kali-jiri-powder,Organic Black Cumin Powder - Pure and Potent
gid://shopify/Product/9272336351574,spirulina-capsule-60-percent-protein,Spirulina Capsule - High Protein Supplement
gid://shopify/Product/9272336482646,22cm-honey-plant-light-green-terracotta-pot,Honey Plant Light Green in Terracotta Pot - 22cm
gid://shopify/Product/9272336744790,35cm-artificial-ficus-plant-teal-blue-green-ceramic-planter,Artificial Ficus Plant in Teal Blue Green Ceramic Planter - 35cm
gid://shopify/Product/9272337006934,40cm-artificial-pothos-variegated-plant-planter,Artificial Pothos Variegated Plant in 40cm Planter
gid://shopify/Product/9272337236310,75cm-artificial-palm-tree-unpotted-6-leaves,Artificial Palm Tree - 75cm Height - 6 Leaves
gid://shopify/Product/9272337432918,40cm-artificial-fern-plant-ceramic-planter-stand,Artificial Fern Plant in Ceramic Planter with Stand - 40cm
gid://shopify/Product/9272337760598,22cm-foliage-honey-plant-light-green-terracotta-pot,Foliage Honey Plant in Light Green Terracotta Pot - 22cm
gid://shopify/Product/9272337891670,20cm-artificial-cactus-plant-arrangement-ceramic-planter,Artificial Cactus Plant Arrangement in Ceramic Planter - 20cm
gid://shopify/Product/9272338219350,35cm-artificial-ficus-plant-teal-blue-green-ceramic-planter-1,Artificial Ficus Plant with Teal Blue Green Ceramic Planter - 35cm
gid://shopify/Product/9272338383190,22cm-foliage-honey-plant-dark-green-terracotta-pot,Dark Green Foliage Honey Plant in 22cm Terracotta Pot
gid://shopify/Product/9272338579798,40cm-artificial-pothos-plant-variegated-shrub-planter,Artificial Pothos Variegated Shrub Plant in 40cm Planter
gid://shopify/Product/9272338776406,60cm-artificial-devils-ivy-scindapsus-aureus-plant,Artificial Devil's Ivy Plant - Scindapsus Aureus - 60cm Tall
gid://shopify/Product/9272338874710,20cm-artificial-cactus-arrangement-ceramic-planter,Artificial Cactus Arrangement in Ceramic Planter - 20cm
gid://shopify/Product/9272339038550,artificial-christmas-xmas-red-poinsettia-40cm-potted-houseplant,Christmas Red Poinsettia 40cm Potted Houseplant for Festive Decor
gid://shopify/Product/9272339202390,22cm-honey-plant-dark-green-terracotta-pot,Honey Plant in 22cm Dark Green Terracotta Pot
gid://shopify/Product/9272339398998,50cm-luxury-artificial-evergreen-fern-plant,Luxury Artificial Evergreen Fern Plant - 50cm
gid://shopify/Product/9272339562838,43cm-pink-yellow-artificial-orchid-ceramic-planter,Stunning 43cm Pink Yellow Artificial Orchid in Ceramic Planter
gid://shopify/Product/9272339726678,centrefeed-white-roll-12,White Centrefeed Roll - 12 Pack
gid://shopify/Product/9272339923286,beautz-chunky-glitter-5-varieties-10ml-pot-5g-cosmetic-glitter-gold,Beautz Chunky Glitter - 5 Varieties - 10ml Pot with 5g of Cosmetic Glit[Gold]
gid://shopify/Product/9272340414806,matte-lipstick-set-nude-waterproof-durable-liquid-lipsticks-beauty-lip-gloss-impressive-matte,Matte Lipstick Set - Nude Waterproof Durable Liquid Lipsticks Beauty Lip Gloss
gid://shopify/Product/9272340513110,4pcs-set-styling-clip-bun-maker-hair-twist-braid-ponytail-tool-accessories-blue,Blue Styling Clip Bun Maker Hair Twist Braid Ponytail Tool Set
gid://shopify/Product/9272340775254,beautz-chunky-glitter-5-varieties-10ml-pot-5g-cosmetic-glitter-silver,Beautz Chunky Glitter - 5 Varieties - 10ml Pot with 5g Cosmetic Glitter (Silver)
gid://shopify/Product/9272341004630,beautz-chunky-glitter-5-varieties-10ml-pot-5g-cosmetic-glitter-mermaid,Beautz Chunky Glitter in 5 Varieties - 10ml Pot with 5g of Cosmetic Glitter - Mermaid-Inspired
gid://shopify/Product/9272341725526,beautz-chunky-glitter-5-varieties-10ml-pot-5g-cosmetic-glit-fairy,Beautz Chunky Glitter: 5 Varieties 10ml Pot with 5g of Cosmetic Glit[Fairy]
gid://shopify/Product/9272341987670,beautz-chunky-glitter-5-varieties-10ml-pot-5g-cosmetic-glitter-unicorn,Beautz Chunky Glitter - 5 Varieties - 10ml Pot with 5g of Cosmetic Glitter
gid://shopify/Product/9272342118742,50cm-dark-pink-artificial-orchid-ceramic-planter,Dark Pink Artificial Orchid in Ceramic Planter - 50cm
gid://shopify/Product/9272342708566,he-shi-express-liquid-instant-self-tan-150ml-medium-tan-quick-dry-easy-to-apply,He-Shi Express Liquid Self Tan - Medium Tan 150ml - Quick Dry & Easy Application
gid://shopify/Product/9272342806870,he-shi-tan-remover-primer-fake-self-tan-exfoliator-150ml,He-Shi Tan Remover & Primer - Fake Self Tan Exfoliator 150ml
gid://shopify/Product/9272343101782,he-shi-rapid-1-hour-liquid-self-tan-medium-dark-tan-quick-dry,He-Shi Rapid 1 Hour Liquid Self Tan - Medium to Dark - Quick Dry
gid://shopify/Product/9272343396694,he-shi-gold-foaming-mousse-medium-self-tan-quick-dry-easy-apply,He-Shi Gold Foaming Mousse - Medium Self Tan - Quick Dry - Easy Application
gid://shopify/Product/9272343626070,he-shi-dark-foaming-mousse-dark-self-tan-quick-dry-easy-to-apply,He-Shi Dark Foaming Mousse - Dark Self Tan - Quick Dry & Easy Application
gid://shopify/Product/9272344052054,he-shi-h2o-glow-hyaluronic-facial-mist-clear-tan-100ml-spritz,He-Shi H2O Glow Hyaluronic Facial Mist - Spritz 100ml
gid://shopify/Product/9272344248662,he-shi-hydra-luxe-lotion-medium-self-tan-easy-to-apply-pump-action,He-Shi Hydra Luxe Lotion - Medium Self Tan - Pump Action
gid://shopify/Product/9272344740182,he-shi-overnight-hyaluronic-self-tan-balm-50ml-relaxing-facial-night-tan,He-Shi Overnight Hyaluronic Self Tan Balm 50ml - Facial Night Tan
gid://shopify/Product/9272345035094,he-shi-day-to-day-gradual-tan-200ml-nourishing-cream-self-tan,He-Shi Gradual Tan Nourishing Cream 200ml - Self Tan
gid://shopify/Product/9272345362774,he-shi-med-dark-gradual-tan-guide-colour-easy-apply-self-tan,He-Shi Med/Dark Gradual Tan - Guide Colour - Easy to Apply Self-Tanning
gid://shopify/Product/9272345657686,he-shi-hd-wonder-glow-body-make-up-wash-off,He-Shi HD Wonder Glow Body Make Up Wash Off
gid://shopify/Product/9272346050902,toile-200-thread-count-cotton-rich-duvet-cover-set,200 Thread Count Cotton Rich Duvet Cover Set in Toile Print
gid://shopify/Product/9272346280278,seagull-turkish-cotton-jacquard-towel,Turkish Cotton Seagull Jacquard Towel
gid://shopify/Product/9272346542422,botanical-leaf-turkish-cotton-jacquard-towel,Turkish Cotton Jacquard Botanical Leaf Towel - Luxurious and Stylish
gid://shopify/Product/9272346870102,125cm-artificial-hanging-trailing-mint-leaf-garland-plant,Artificial Hanging Trailing Mint Leaf Garland Plant - Perfect Home Decor Accent!
gid://shopify/Product/9272347197782,abstract-marble-teal-gold-sw12,Marble Teal and Gold Abstract Wallpaper
gid://shopify/Product/9272347492694,wood-slats-charcoal-grey-sw12,Charcoal Grey Wood Slats
gid://shopify/Product/9272347722070,wood-slats-natural-sw12,Natural Wood Slats - Handcrafted and Sustainable
gid://shopify/Product/9272347951446,small-bamboo-chime,Mini Bamboo Wind Chime
gid://shopify/Product/9272349229398,30cm-bat-wall-hook,Decorative Bat Wall Hook - 30cm Length
gid://shopify/Product/9272349819222,painted-canvas-navy-sw12,Canvas Navy Painted Artwork - SW12
gid://shopify/Product/9272349983062,exotic-incense-100g,100g Exotic Incense - A Fragrant Delight for Your Home
gid://shopify/Product/9272350179670,frankincense-incense-100g,Premium Frankincense Incense - 100g
gid://shopify/Product/9272350376278,lavender-incense-100g,Lavender Incense - Natural Aromatherapy for Relaxation
gid://shopify/Product/9272350638422,nagchampa-incense-100g,Premium Nagchampa Incense - 100g
gid://shopify/Product/9272350769494,palo-santo-incense-100g,Palo Santo Incense - High-Quality 100g Bundle
gid://shopify/Product/9272350998870,patchouli-incense-100g,Patchouli Incense 100g - Buy Now for a Sensory Experience
gid://shopify/Product/9272351228246,rose-incense-100g,100g Rose Incense - Premium Aroma for Serene Spaces
gid://shopify/Product/9272351392086,simply-sandalwood-incense-100g,Pure Sandalwood Incense Sticks - 100g
gid://shopify/Product/9272351621462,white-sage-incense-100g,Premium White Sage Incense - 100g
gid://shopify/Product/9272352145750,12-fragrance-gift-pack-burner,Premium 12-Piece Fragrance Gift Set with Burner
gid://shopify/Product/9272352375126,6-fragrance-gift-pack-burner,Premium Fragrance Gift Pack with Burner
gid://shopify/Product/9272352604502,dragon-blood-incense-100g,Dragon Blood Incense - Pure 100g Fragrant Sticks
gid://shopify/Product/9272352801110,pop-up-beach-tent-blue,Portable Blue Pop Up Beach Tent for Ultimate Fun in the Sun
gid://shopify/Product/9272352997718,regina-thirst-pockets-mini-20-pack,Regina Thirst Pockets Mini - 20 Pack
gid://shopify/Product/9272353161558,vinsani-black-mesh-bin-2pc-1010404,Vinsani Black Mesh Bin
gid://shopify/Product/9272353358166,30cm-artificial-potted-lady-fern-athyrium-filix-femina,Artificial Potted Lady Fern - 30cm Athyrium Filix-Femina
gid://shopify/Product/9272353489238,dusty-pink-peach-raised-dots-ceramic-plant-pot-15x15x12-5cm,Dusty Pink Peach Raised Dots Ceramic Plant Pot - Stylish Home Decor Accent
gid://shopify/Product/9272353718614,30cm-green-cube-glass-vase-1,Green Cube Glass Vase - 30cm
gid://shopify/Product/9272353882454,70cm-uv-resistant-artificial-geranium-bush-1,UV Resistant Artificial Geranium Bush - 70cm | High-Quality Fake Plant
gid://shopify/Product/9272354013526,28cm-green-ridged-glass-vase-28cm-green-ridged-glass-vase,Green Ridged Glass Vase - 28cm Height
gid://shopify/Product/9272354275670,60cm-bushy-large-artificial-birds-nest-fern-plant,Large Artificial Bird's Nest Fern Plant - 60cm Bushy Greenery
gid://shopify/Product/9272354472278,80cm-artificial-trailing-green-eucalyptus-plant-realistic,Realistic 80cm Artificial Trailing Green Eucalyptus Plant
gid://shopify/Product/9272354734422,50cm-phalaenopsis-orchid-artificial-light-pink-silver,Phalaenopsis Orchid Artificial Light Pink Silver - 50cm
gid://shopify/Product/9272355094870,46cm-artificial-orchid-white-silver-pot-1,Artificial White Orchid in Elegant Silver Pot - 46cm
gid://shopify/Product/9272355225942,30cm-silver-dot-glass-vase,Silver Dot Glass Vase - 30cm Height
gid://shopify/Product/9272355357014,50cm-phalaenopsis-orchid-artificial-red-leopard-gold-pot,Phalaenopsis Orchid Artificial Red Leopard Gold Pot - 50cm
gid://shopify/Product/9272355553622,80cm-artificial-red-christmas-berry-spray,Artificial Red Christmas Berry Spray - 80cm Length
gid://shopify/Product/9272355717462,50cm-phalaenopsis-orchid-artificial-purple-and-white-gold-pot-50cm-phalaenopsis-orchid-artificial-purple-white-gold-pot,Phalaenopsis Orchid Artificial Purple and White in Gold Pot - 50cm
gid://shopify/Product/9272355815766,30cm-artificial-potted-southern-wood-fern-2,Artificial Potted Southern Wood Fern - 30cm Size - Perfect Greenery for Home Decor
gid://shopify/Product/9272356012374,40cm-artificial-pothos-plant-variegated-shrub-planter-1,Artificial 40cm Variegated Pothos Plant Shrub with Planter
gid://shopify/Product/9272356143446,20cm-artificial-cactus-plant-arrangement-ceramic-planter-1,Artificial Cactus Plant Arrangement in Ceramic Planter - 20cm
gid://shopify/Product/9272356307286,46cm-artificial-orchid-white-gold,Orchid White and Gold 46cm Artificial
gid://shopify/Product/9272356438358,gold-ceramic-planter-bamboo-stand-plant-pot,Gold Ceramic Planter with Bamboo Stand - Stylish Plant Pot
gid://shopify/Product/9272356569430,white-honeycomb-speckled-ceramic-planter-plant-pot,Modern White Honeycomb Ceramic Plant Pot
gid://shopify/Product/9272356700502,35cm-artificial-potted-fern-plant-southern-maidenhair-fern,Artificial Potted Southern Maidenhair Fern Plant - 35cm
gid://shopify/Product/9272356766038,100cm-artificial-hanging-maidenhair-fern-plant-dark-green,Artificial Hanging Maidenhair Fern Plant - Dark Green - 100cm
gid://shopify/Product/9272356897110,12cm-ceramic-rainbow-multicolour-planter,Ceramic Rainbow Multicolour Planter - 12cm
gid://shopify/Product/9272357093718,28cm-gold-rim-smoke-grey-glass-vase,Gold Rim Smoke Grey Glass Vase - Stylish 28cm Home Decor Accent
gid://shopify/Product/9272357224790,46cm-artificial-orchid-red-silver-pot-2,Artificial Red Orchid in Silver Pot - 46cm
gid://shopify/Product/9272357421398,46cm-artificial-orchid-dark-pink-gold,Artificial Orchid Dark Pink and Gold - 46cm
gid://shopify/Product/9272357519702,white-ceramic-planter-metal-stand-plant-pot,Modern White Ceramic Planter with Metal Stand
gid://shopify/Product/9272357618006,30cm-green-retro-bubble-vase-1,Green Retro Bubble Vase - 30cm Height
gid://shopify/Product/9272357814614,23cm-diamond-embossed-pink-glass-vase-1,Diamond Embossed Pink Glass Vase - 23cm Height
gid://shopify/Product/9272357945686,30cm-smoke-grey-ridged-glass-vase-1,Ridged Glass Vase - Smoke Grey - 30cm
gid://shopify/Product/9272358109526,50cm-phalaenopsis-orchid-artificial-dark-pink-silver,Phalaenopsis Orchid Artificial Dark Pink Silver - 50cm
gid://shopify/Product/9272358273366,46cm-artificial-orchid-harlequin-pink-silver-pot-2,Artificial Orchid Harlequin Pink in Silver Pot - 46cm
gid://shopify/Product/9272358404438,40cm-artificial-fern-plant-ceramic-planter-stand,Artificial Fern Plant with Ceramic Planter and Stand - 40cm
gid://shopify/Product/9272358601046,35cm-smoke-grey-bubble-vase-1,Smoke Grey Bubble Vase - 35cm Height
gid://shopify/Product/9272358830422,30cm-artificial-potted-royal-fern-2,Artificial Potted Royal Fern - 30cm - Decorate Your Space with Greenery!
gid://shopify/Product/9272358994262,12cm-blue-sand-stripe-ceramic-planter,Blue Sand Stripe Ceramic Planter - 12cm Size
gid://shopify/Product/9272359387478,35cm-artificial-ficus-plant-teal-blue-green-ceramic-planter-2,Artificial Ficus Plant in Teal Blue Green Ceramic Planter - 35cm
gid://shopify/Product/9272359584086,31cm-clear-ridged-glass-vase-1,Clear Ridged Glass Vase - 31cm
gid://shopify/Product/9272359944534,dark-teal-blue-green-ceramic-planter-with-feet-plant-pot,"Modern Dark Teal Ceramic Planter with Feet
gid://shopify/Product/9272360173910,30cm-mulberry-purple-bubble-glass-vase-1,Mulberry Purple Bubble Glass Vase - 30cm Height
gid://shopify/Product/9272360436054,48cm-harlequin-orchid-artificial-pink-gold-pot,Harlequin Orchid Artificial Flower in Pink and Gold Pot - 48cm
gid://shopify/Product/9272360665430,polyester-500g-pillow-pair,Soft Polyester 500g Pillow Pair - Hypoallergenic & Premium Quality
gid://shopify/Product/9272360862038,harwoods-hollowfibre-pillow-pair,Premium Harwoods Hollowfibre Pillow Set - Ultimate Comfort for a Restful Sleep
gid://shopify/Product/9272360993110,supreme-hotel-pillow,Premium Supreme Hotel Pillow
gid://shopify/Product/9272361058646,healthflow-pillow,Premium Healthflow Pillow - Ultimate Comfort for Restful Sleep
gid://shopify/Product/9272361255254,large-red-pet-food-storage-scoop-as70586-twl1764,Red Large Pet Food Storage Container with Scoop
gid://shopify/Product/9272361386326,the-connoisseurs-set-nosing-glass-edition,The Connoisseur's Nosing Glass Set
gid://shopify/Product/9272361714006,the-privilege-collection-prestige-glasses,Privilege Collection Prestige Glasses
gid://shopify/Product/9272361877846,the-connoisseurs-set-reserve-glass-edition,The Connoisseur's Reserve Glass Set
gid://shopify/Product/9272362008918,the-original-rocks,Premium Natural Stone Collection
gid://shopify/Product/9272362205526,the-privilege-collection-admiral-glasses,The Privilege Collection Admiral Glasses - Exclusive Eyewear Picks
gid://shopify/Product/9272362303830,the-rocks-trivia-quiz-set,The Rocks Trivia Quiz Set
gid://shopify/Product/9272362467670,vera-wang-lovestruck-eau-de-parfum-spray-100ml,Vera Wang Lovestruck Eau de Parfum Spray 100ml
gid://shopify/Product/9272362631510,halston-classic-eau-de-cologne-spray-100ml,Halston Classic Cologne Spray - 100ml"
gid://shopify/Product/9272362828118,guess-seductive-pour-homme-eau-de-toilette-spray-100ml,Guess Seductive Pour Homme 100ml Eau De Toilette Spray
gid://shopify/Product/9272362991958,elizabeth-arden-green-tea-scent-spray-100ml,Elizabeth Arden Green Tea Scent Spray - 100ml
gid://shopify/Product/9272363286870,burberry-weekend-eau-de-parfum-spray-50ml,Burberry Weekend Eau De Parfum Spray - 50ml
gid://shopify/Product/9272363516246,hugo-boss-energise-eau-de-toilette-spray-75ml,Hugo Boss Energise Eau de Toilette Spray - 75ml
gid://shopify/Product/9272363811158,jovan-black-musk-cologne-spray-88ml,Jovan Black Musk Cologne Spray - 88ml
gid://shopify/Product/9272364106070,montblanc-individuel-eau-de-toilette-spray-75ml,Montblanc Individuel Eau De Toilette 75ml Spray
gid://shopify/Product/9272364368214,karl-lagerfeld-classic-eau-de-toilette-spray-100ml,Karl Lagerfeld Classic EDT Spray 100ml
gid://shopify/Product/9272364892502,joop-femme-eau-de-toilette-spray-100ml,Joop Femme Eau De Toilette Spray - 100ml
gid://shopify/Product/9272365089110,christian-audigier-ed-hardy-eau-de-parfum-spray-100ml,Ed Hardy Christian Audigier Eau De Parfum Spray - 100ml
gid://shopify/Product/9272365285718,davidoff-coolwater-after-shave,Davidoff Coolwater After Shave - Buy Now for Fresh Fragrance
gid://shopify/Product/9272365678934,moschino-funny-eau-de-toilette-spray-100ml,Moschino Funny Eau De Toilette Spray - 100ml
gid://shopify/Product/9272366301526,apple-blossom-shower-gel-200ml,Apple Blossom Shower Gel - 200ml
gid://shopify/Product/9272366530902,vera-wang-princess-eau-de-toilette-spray-100ml,Vera Wang Princess 100ml Eau de Toilette Spray
gid://shopify/Product/9272366661974,lacoste-l12-12-pour-elle-french-panache-eau-de-toilette-spray-50ml,Lacoste L.12.12 Pour Elle French Panache Eau De Toilette 50ml Spray
gid://shopify/Product/9272367317334,diesel-fuel-4-life-woman-eau-de-parfum-spray-50ml,DIESEL Fuel 4 Life Woman Eau De Parfum Spray - 50ml
gid://shopify/Product/9272367513942,isseymiyake-nuit-dissey-deo-spray-150ml,Issey Miyake Nuit D'issey Deo Spray - 150ml
gid://shopify/Product/9272367743318,apple-blossom-3x50g-soaps,Apple Blossom Natural Handmade Soap Set - Pack of 3 x 50g
gid://shopify/Product/9272368005462,karl-lagerfeld-classic-eau-de-toilette-spray-150ml,Karl Lagerfeld Classic Eau De Toilette Spray 150ml - Buy Now!
gid://shopify/Product/9272368267606,hugo-boss-dark-blue-eau-de-toilette-spray-75ml,Hugo Boss Dark Blue Eau De Toilette Spray 75ml
gid://shopify/Product/9272368431446,ck-one-shock-for-him-eau-de-toilette-spray-200ml,CK ONE SHOCK Eau De Toilette Spray 200ML for Men
