Id,Handle,Title
gid://shopify/Product/9272289034582,88cm-white-artificial-sunflower-3-heads,White Artificial Sunflower with 3 Heads - 88cm
gid://shopify/Product/9272289263958,50cm-artificial-trailing-begonia-plant,Artificial Trailing Begonia Plant - 50cm - Lush Greenery for Home Decor
gid://shopify/Product/9272289460566,50cm-phalaenopsis-orchid-artificial-purple-white-gold-pot,Phalaenopsis Orchid Artificial in Purple and White with Gold Pot - 50cm
gid://shopify/Product/9272289657174,48cm-harlequin-orchid-artificial-pink-gold-pot,Harlequin Orchid Artificial - Pink with Gold Pot - 48cm
gid://shopify/Product/9272289788246,31cm-clear-ridged-glass-vase,Clear Ridged Glass Vase - Stunning 31cm Home Decor Accent
gid://shopify/Product/9272289886550,110cm-artificial-trailing-hanging-aralia-plant-realistic,Artificial Trailing Hanging Aralia Plant - Lifelike Greenery for Home Decor
gid://shopify/Product/9272290115926,two-ceramic-jars-embossed-cream-canisters-with-lids,Embossed Cream Ceramic Jars Set of 2 Canisters with Lids
gid://shopify/Product/9272290279766,75cm-extra-large-reflex-chrysanthemum-gold,Extra Large Reflex Chrysanthemum in Gold - 75cm
gid://shopify/Product/9272290378070,50cm-phalaenopsis-orchid-artificial-red-leopard-gold-pot,Red Leopard Phalaenopsis Orchid Artificial Flower in Gold Pot - 50cm
gid://shopify/Product/9272290509142,100cm-artificial-hanging-maidenhair-fern-plant-dark-green-100cm-artificial-hanging-maidenhair-fern-plant-dark-green,Artificial Hanging Maidenhair Fern Plant - Dark Green - 100cm
gid://shopify/Product/9272290672982,5cm-extra-large-reflex-chrysanthemum-black,Extra Large Reflex Chrysanthemum - Black - 75cm
gid://shopify/Product/9272290836822,pack-6-90cm-artificial-yellow-berry-stem,Artificial Yellow Berry Stem Pack of 6 Stems - 90cm Each
gid://shopify/Product/9272291197270,80cm-artificial-trailing-green-eucalyptus-plant-realistic,Realistic 80cm Artificial Trailing Green Eucalyptus Plant
gid://shopify/Product/9272291393878,70cm-artificial-green-berry-spray,Artificial Green Berry Spray - 70cm
gid://shopify/Product/9272291623254,35cm-artificial-trailing-light-green-plant,Artificial Trailing Light Green Plant - 35cm
gid://shopify/Product/9272291787094,6-pack-80cm-artificial-purple-wild-rose-stem-36-flowers,Artificial Purple Wild Rose Stem with 36 Flowers - Pack of 6
gid://shopify/Product/9272292016470,30cm-smoke-grey-ridged-glass-vase,Smoke Grey Ridged Glass Vase - 30cm
gid://shopify/Product/9272292180310,50cm-phalaenopsis-orchid-artificial-dark-pink-silver,Dark Pink Silver Phalaenopsis Orchid Artificial - 50cm
gid://shopify/Product/9272292376918,100cm-artificial-trailing-hanging-philodendron-small-leaf-plant-realistic,Artificial Trailing Hanging Small Leaf Philodendron Plant - Realistic 100cm
gid://shopify/Product/9272292507990,40cm-artificial-trailing-variegated-marble-pothos-plant-realistic,Artificial Trailing Variegated Marble Pothos Plant - 40cm Realistic and Lifelike
gid://shopify/Product/9272292737366,125cm-artificial-trailing-hanging-mint-leaf-garland-plant-realistic,Artificial Trailing Hanging Mint Leaf Garland Plant - Realistic and Life-like Decoration
gid://shopify/Product/9272292999510,46cm-artificial-orchid-red-silver-pot,Artificial Red Orchid in 46cm Silver Pot
gid://shopify/Product/9272293163350,46cm-artificial-orchid-white-gold,Artificial White Gold Orchid - 46cm Height
gid://shopify/Product/9272293327190,40cm-artificial-trailing-variegated-marble-pothos-plant,Artificial Trailing Variegated Marble Pothos Plant - 40cm
gid://shopify/Product/9272293458262,28cm-gold-rim-smoke-grey-glass-vase,Gold Rim Smoke Grey Glass Vase - 28cm Height
gid://shopify/Product/9272293556566,100cm-realistic-artificial-palm-leaf,Realistic Artificial Palm Leaf - Natural 100cm Length
gid://shopify/Product/9272293785942,23cm-diamond-embossed-pink-glass-vase,Diamond Embossed Pink Glass Vase - 23cm Height
gid://shopify/Product/9272293982550,30cm-mulberry-purple-bubble-glass-vase,Mulberry Purple Bubble Glass Vase - 30cm Height
gid://shopify/Product/9272294211926,46cm-artificial-orchid-harlequin-pink-silver-pot,Artificial Orchid Harlequin Pink in Silver Pot - 46cm
gid://shopify/Product/9272294441302,pack-6-95cm-green-palm-leaf,Pack of 6 Green Palm Leaf Straws - 95cm length
gid://shopify/Product/9272294670678,50cm-phalaenopsis-orchid-artificial-dark-pink-silver,Phalaenopsis Orchid Artificial - Dark Pink Silver - 50cm
gid://shopify/Product/9272294932822,6-pack-80cm-artificial-white-wild-rose-stem-36-flowers,Artificial White Wild Rose Stem | Pack of 6 - 80cm | 36 Flowers
gid://shopify/Product/9272295063894,30cm-green-retro-bubble-vase,Green Retro Bubble Vase - 30cm
gid://shopify/Product/9272295194966,180cm-artificial-trailing-hanging-garland-amaranthus-plant,Artificial Trailing Hanging Garland Amaranthus Plant - Lifelike Decor for Indoor & Outdoor Spaces
gid://shopify/Product/9272295358806,50cm-phalaenopsis-orchid-artificial-light-pink-silver,Phalaenopsis Orchid Artificial Light Pink Silver - 50cm
gid://shopify/Product/9272295522646,120cm-artificial-hanging-string-pearls,Extra Long String of Pearls - 120cm Artificial Hanging Plant
gid://shopify/Product/9272295686486,88cm-purple-artificial-sunflower-3-heads,Handmade Purple Sunflower Bouquet - 3 Flower Heads
gid://shopify/Product/9272295850326,75cm-extra-large-reflex-chrysanthemum-red,Extra Large Reflex Chrysanthemum in Red - 75cm
gid://shopify/Product/9272296178006,46cm-artificial-orchid-dark-pink-gold,Artificial Dark Pink/Gold Orchid - 46cm - Premium Quality
gid://shopify/Product/9272296309078,28cm-green-ridged-glass-vase,Green Ridged Glass Vase - 28cm Height
gid://shopify/Product/9272296440150,75cm-extra-large-reflex-chrysanthemum-pink,Extra Large Reflex Chrysanthemum - Pink - 75cm
gid://shopify/Product/9272296571222,pack-6-70cm-artificial-orange-berry-spray,Artificial Orange Berry Spray Bundle - Set of 6 - 70cm
gid://shopify/Product/9272296702294,35cm-artificial-trailing-light-natural-look-plant-realistic,Artificial Trailing Light Plant | 35cm | Natural Look | Realistic
gid://shopify/Product/9272296833366,46cm-artificial-orchid-dark-pink-gold,Artificial Dark Pink / Gold Orchid - 46cm
gid://shopify/Product/9272296997206,100cm-artificial-hanging-maidenhair-fern-plant-light-green,Artificial Hanging Maidenhair Fern Plant - Light Green - 100cm
gid://shopify/Product/9272297161046,50cm-phalaenopsis-orchid-artificial-red-leopard-gold-pot,Red Leopard Phalaenopsis Orchid Artificial Plant in Gold Pot - 50cm
gid://shopify/Product/9272297259350,pack-6-60cm-white-starflower-stem-30-flowers,White Starflower Stem Bundle - Set of 6 Stems
gid://shopify/Product/9272297390422,46cm-artificial-orchid-white-gold,Artificial White / Gold Orchid - 46cm
gid://shopify/Product/9272297587030,50cm-phalaenopsis-orchid-artificial-light-pink-silver,Phalaenopsis Orchid Artificial - Light Pink Silver - 50cm
gid://shopify/Product/9272297816406,6-pack-80cm-dark-pink-artificial-mini-orchid-stem,6-Pack 80cm Dark Pink Artificial Mini Orchid Stem - Premium Quality
gid://shopify/Product/9272297914710,30cm-green-cube-glass-vase,Green Cube Glass Vase - 30cm Height
gid://shopify/Product/9272298045782,46cm-artificial-orchid-harlequin-pink-silver-pot-1,Artificial Orchid Harlequin Pink in Silver Pot - 46cm
gid://shopify/Product/9272298209622,46cm-artificial-orchid-white-silver-pot,White Artificial Orchid in Silver Pot - Elegant 46cm Decoration
gid://shopify/Product/9272298340694,95cm-green-palm-leaf,Green Palm Leaf - 95cm
gid://shopify/Product/9272298537302,6-pack-100cm-realistic-artificial-palm-leaf,Realistic Artificial Palm Leaf Set of 6 - 100cm Each
gid://shopify/Product/9272298635606,35cm-smoke-grey-bubble-vase,Smoke Grey Bubble Vase - 35cm Height
gid://shopify/Product/9272298799446,75cm-extra-large-reflex-chrysanthemum-orange,Extra Large Reflex Chrysanthemum - Orange (75cm)
gid://shopify/Product/9272298897750,95cm-gold-palm-leaf,Gold Palm Leaf Decor - Exquisite 95cm
gid://shopify/Product/9272299094358,46cm-artificial-orchid-white-silver-pot,Artificial White Orchid in Silver Pot - 46cm
gid://shopify/Product/9272299258198,46cm-artificial-orchid-red-silver-pot-1,Artificial Red Orchid in Silver Pot - 46cm
gid://shopify/Product/9272299684182,bound-play-hot-wax-candle-black,Hot Wax Candle in Black - Bound to Play Collection
gid://shopify/Product/9272299848022,bound-to-play-hot-wax-candle-red,Hot Wax Candle - Red | Bound to Play Collection
gid://shopify/Product/9272300077398,kitchen-wall-hooks-4-hooks-rolling-pin-design,Rolling Pin Design Kitchen Wall Hooks - Set of 4
gid://shopify/Product/9272300274006,cast-iron-rustic-towel-ring-stag-head-design,Rustic Stag Head Cast Iron Towel Ring
gid://shopify/Product/9272300405078,wall-mounted-black-metal-wine-bottle-holder,Black Metal Wall Mounted Wine Bottle Holder
gid://shopify/Product/9272300536150,rustic-cast-iron-wall-hooks-dog-tail-design-6-hooks,Rustic Cast Iron Wall Hooks | Dog Tail Design - 6 Hooks
gid://shopify/Product/9272300699990,vinsetto-wooden-table-easel-box-canvas-adjustable-sketch-board-61cm,Vinsetto Wooden Table Easel Box for Canvases up to 61cm - Adjustable Sketch Board
gid://shopify/Product/9272300962134,vinsetto-wooden-table-easel-box-storage-portable-folding-artist-easel,Vinsetto Wooden Table Easel Box with Storage - Portable Folding Artist Easel
gid://shopify/Product/9272301388118,dog-pram-rain-cover-front-rear-entry,Waterproof Dog Pram Cover with Front and Rear Entry
gid://shopify/Product/9272301584726,cat-tree-kitten-scratcher-activity-centre-sisal-scratching-post-toy-ball,Cat Tree Activity Centre with Sisal Scratching Post and Toy Ball
gid://shopify/Product/9272301846870,cardboard-scratcher-lounger-bed-cat-scratching-board-catnip-60x29x26-5cm,Cat Cardboard Scratcher Lounger Bed with Catnip - 60x29x26.5cm
gid://shopify/Product/9272301977942,ravel-mini-bedside-alarm-clock-white-rc043-4,White Rectangular Mini Bedside Quartz Alarm Clock - Ravel RC043
gid://shopify/Product/9272302076246,ravel-mini-bedside-quartz-alarm-clock-black-rc043-3,Ravel Rectangular Mini Bedside Quartz Alarm Clock in Black
gid://shopify/Product/9272302240086,ravel-rectangular-mini-bedside-quartz-alarm-clock-pink-rc0435,Ravel Pink Rectangular Mini Bedside Alarm Clock - Quartz RC
gid://shopify/Product/9272302371158,ravel-mini-black-alarm-clock-rc018-3,Ravel Mini Black Alarm Clock
gid://shopify/Product/9272302633302,ravel-rectangular-mini-bedside-quartz-alarm-clock-blue-rc043-6,Blue Ravel Rectangular Mini Bedside Quartz Alarm Clock
gid://shopify/Product/9272302960982,domestic-king-2-slice-white-sandwich-maker-dk180100,Domestic King 2 Slice White Sandwich Maker 750W
gid://shopify/Product/9272303288662,35cm-artificial-potted-fern-plant-southern-maidenhair-fern,Artificial Potted Southern Maidenhair Fern Plant - 35cm
gid://shopify/Product/9272303583574,30cm-artificial-potted-southern-wood-fern,Artificial Potted Southern Wood Fern - 30cm Height
gid://shopify/Product/9272303780182,30cm-artificial-potted-southern-wood-fern-1,Artificial Potted Southern Wood Fern - 30cm
gid://shopify/Product/9272304042326,30cm-artificial-potted-royal-fern,Artificial Potted Royal Fern - 30cm Height
gid://shopify/Product/9272304304470,30cm-artificial-potted-lady-fern-athyrium-filix-femina,Artificial Potted Lady Fern - Athyrium Filix-Femina - 30cm
gid://shopify/Product/9272304632150,30cm-artificial-potted-lady-fern-athyrium-filix-femina-1,Artificial Potted Lady Fern - Athyrium Filix-Femina - 30cm
gid://shopify/Product/9272304763222,30cm-artificial-potted-royal-fern-1,Artificial Potted Royal Fern - 30cm
gid://shopify/Product/9272304992598,retro-dome-easy-fit-light-shades-modern-ceiling-pendant-lampshades-metal-colors,Modern Metal Ceiling Pendant Lampshades in Retro Dome Design
gid://shopify/Product/9272305287510,industrial-retro-light-shade-flush-mount-modern-black-ceiling-light,Modern Black Industrial Retro Ceiling Light Flush Mount Shade
gid://shopify/Product/9272305680726,ceiling-rose-3-way-hanging-pendant-lamp-shade-light-fitting-lighting-kit-uk,3-Way Ceiling Rose Hanging Pendant Lamp Shade Light Fitting Kit - UK Lighting
gid://shopify/Product/9272306073942,industrial-brushed-brass-metal-ceiling-light-lampshade-bulb,Brushed Brass Metal Ceiling Light Lampshade with Bulb - Industrial Style
gid://shopify/Product/9272306729302,35m-telescopic-window-cleaner-black,Telescopic Black Window Cleaner - 3.5M Reach
gid://shopify/Product/9272306893142,vinsani-xmas-baubles-tinsel-storage-bag-1010395,Vinsani Christmas Baubles and Tinsel Storage Bag
gid://shopify/Product/9272306991446,clothes-rail-black-two-shelves-powder-coating,Black Clothes Rail with Two Shelves - Powder Coated for Modern Style
gid://shopify/Product/9272307188054,vinsani-jumbo-heavy-duty-storage-bag-1010394,Vinsani Jumbo Heavy Duty Storage Bag - Ultimate Storage Solution
gid://shopify/Product/9272307417430,55cm-himalayan-maidenhair-fern-bush-dark-green-plant,Himalayan Maidenhair Fern Dark Green Plant - 55cm
gid://shopify/Product/9272307581270,pack-6-75cm-extra-large-reflex-chrysanthemum-pink,Extra Large Reflex Chrysanthemum - Pink (Pack of 6)
gid://shopify/Product/9272307679574,80cm-artificial-red-christmas-berry-spray,Artificial Red Christmas Berry Spray - 80cm
gid://shopify/Product/9272307810646,55cm-himalayan-maidenhair-fern-bush-light-green-plant,Himalayan Maidenhair Fern Bush - Light Green Plant - 55cm
gid://shopify/Product/9272308072790,pack-6-100cm-artificial-poppy-stem-2-flowers,6-Pack Artificial Poppy Stem with 2 Flowers - 100cm
gid://shopify/Product/9272308171094,pack-6-70cm-pink-artificial-carnation-stem-24-flowers,6-Pack Pink Artificial Carnation Stem - 70cm Length - 24 Flowers
gid://shopify/Product/9272308334934,55cm-himilayan-maidenhair-fern-bush-light-green-plant,Himalayan Maidenhair Fern Bush Light Green Plant - 55cm
gid://shopify/Product/9272308531542,6-pack-95cm-artificial-himalayan-maidenhair-fern-stem,6-Pack of Lifelike 95cm Artificial Himalayan Maidenhair Fern Stems
gid://shopify/Product/9272308695382,pack-6-85cm-bamboo-fern-stem,Bamboo Fern Stem Pack - Set of 6 Stems - 85cm Each
gid://shopify/Product/9272308826454,50cm-southern-wood-fern-bush-dark-green-plant,Southern Wood Fern Bush Dark Green Plant - 50cm
gid://shopify/Product/9272308990294,pack-6-60cm-purple-starflower-stem-30-flowers,6-Pack Purple Starflower Stem - 60cm with 30 Flowers - Shop Now!
gid://shopify/Product/9272309186902,pack-6-80cm-purple-larkspur-artificial-stem,6-Pack of Purple Larkspur Artificial Stems - 80cm
gid://shopify/Product/9272309317974,55cm-himalayan-maidenhair-fern-bush-dark-green-plant,Himalayan Maidenhair Fern Bush - Dark Green Plant - 55cm
gid://shopify/Product/9272309481814,pack-6-75cm-extra-large-reflex-chrysanthemum-black,Extra Large Reflex Chrysanthemum - Black - Set of 6
gid://shopify/Product/9272309645654,50cm-southern-wood-fern-bush-dark-green-plant-1,Southern Wood Fern Bush: Lush 50cm Dark Green Plant
gid://shopify/Product/9272309809494,6-pack-75cm-extra-large-reflex-chrysanthemum-purple,Extra Large Reflex Chrysanthemum - Purple - Pack of 6 x 75cm
gid://shopify/Product/9272309940566,30cm-artificial-potted-southern-wood-fern-black-pot,Artificial Potted Southern Wood Fern in 30cm Black Pot
gid://shopify/Product/9272310169942,pack-6-70cm-white-artificial-carnation-stem-24-flowers,White Artificial Carnation Stem - Pack of 6 - 70cm - 24 Flowers
gid://shopify/Product/9272310366550,80cm-artificial-red-christmas-berry-spray-1,Artificial Red Christmas Berry Spray - 80cm
gid://shopify/Product/9272310628694,60cm-leaf-design-realistic-large-artificial-foliage-plant-pot-uk,Realistic Large Artificial Foliage Plant with Pot - Leaf Design - 60cm - UK
gid://shopify/Product/9272311152982,6-100cm-artificial-hanging-maidenhair-fern-plant-light-green,Artificial Hanging Maidenhair Fern Plant - 100cm Light Green
gid://shopify/Product/9272311480662,ceramic-jars-embossed-cream-canisters-lids,Embossed Cream Ceramic Canister Set with Lids
gid://shopify/Product/9272311742806,bound-play-kitty-cat-face-mask-red,Red Kitty Cat Face Mask - Playful and Boundless Style
gid://shopify/Product/9272311939414,play-kitty-cat-face-mask-pink,Kitty Cat Face Mask in Pretty Pink - Shop Now!
gid://shopify/Product/9272312168790,set-of-three-17cm-ceramic-faux-cactus-dracaena-succulents,Set of 3 Ceramic Cactus | Dracaena | Succulents - 17cm
gid://shopify/Product/9272312332630,thai-massage-tool,Authentic Thai Massage Tool - Ultimate Relaxation Experience
gid://shopify/Product/9272312529238,95-percent-pure-oxygen-essential-oil-menthol-eucalyptus-9-litre,9 Litre Menthol-Eucalyptus Oxygen Tank - Pure Essential Oil Aroma
gid://shopify/Product/9272312660310,95-pure-oxygen-peppermint-essential-oil-aroma-100-natural,Peppermint Essential Oil Aroma Infused 95% Pure Oxygen - 100% Natural
gid://shopify/Product/9272312725846,boost-energy-recovery-95-pure-oxygen,Pure Oxygen Energy Boost and Recovery Support
gid://shopify/Product/9272312824150,98-percent-pure-oxygen-essential-oil-aroma-frankincense-pink-grapefruit,Frankincense and Pink Grapefruit Aroma Infused 98% Pure Oxygen
gid://shopify/Product/9272312922454,95-percent-pure-oxygen-organic-rosemary-aroma-natural,Organic Rosemary Essential Oil Infused 95% Pure Oxygen
gid://shopify/Product/9272313119062,95-percent-pure-oxygen-pink-grapefruit-aroma-9-litre,9 Litre Pure Oxygen with Pink Grapefruit Aroma - Natural and Energizing
gid://shopify/Product/9272313348438,artificial-plants-ceramic-planters-displays-home-decor-leaf-design-uk-limited-office-desk,Leaf Design Ceramic Planters for Home and Office Decor in the UK
gid://shopify/Product/9272313577814,artificial-plants-mini-ceramic-planters-home-decor-leaf-design-uk-limited,Leaf Design Ceramic Planters for Home Decor - Mini Desktop Artificial Plants UK
gid://shopify/Product/9272313774422,candle-holder-3x22cm-christmas-gifts-red-pvc-box,Candle Holder 22cm Red PVC Box - Christmas Gift Idea
gid://shopify/Product/9272313971030,aquarius-lcd-writer-85-inch-ultra-bright-sturdy-durable-abs-black,Aquarius LCD Writer 8.5 Inch Ultra-Bright ABS Black
gid://shopify/Product/9272314134870,cat-dog-grooming-gloves-blue,Blue Cat and Dog Grooming Gloves - 1 Pair
gid://shopify/Product/9272314331478,jocca-8led-motion-sensor-wardrobe-light-portable-versatile-led-light-bar-60cm,JOCCA 8LED Motion Sensor Wardrobe Light Portable LED Light Bar - 60cm
gid://shopify/Product/9272314724694,adjustable-cake-slicers-kids-safe,Adjustable Cake Slicers - Non-Sharp Blades - Safe for Kids
gid://shopify/Product/9272314954070,20-led-flexible-thin-copper-wire-string-light-ip65-waterproof,IP65 Waterproof LED Flexible Thin Copper Wire String Lights
gid://shopify/Product/9272315117910,gymcline-body-analysis-scale-bmi-calorie-intake-guide-space-grey,Gymcline Body Analysis Scale with BMI Report & Calorie Intake Guide - Space Grey
gid://shopify/Product/9272315380054,aquarius-suction-sink-sponge-holder-green-aqspongegr,Aquarius Suction Sink Sponge Holder - Green
gid://shopify/Product/9272315740502,eco-connection-50-disposable-natural-bamboo-skewer-forks,Pack of 50 Disposable Natural Bamboo Skewer Forks
gid://shopify/Product/9272315838806,bas-tek-classic-fitness-tracker-bluetooth-bracelet-black,BAS-Tek Classic Fitness Tracker Bluetooth Bracelet in Black
gid://shopify/Product/9272316002646,bas-tek-sport-lightweight-bluetooth-fitness-tracker-black,Bas-Tek Sport Lightweight Bluetooth Fitness Tracker in Black
gid://shopify/Product/9272316199254,bas-tek-classic-fitness-bluetooth-oled-display-sports-activity-bracelet-navy,BAS-Tek Classic Fitness Bluetooth OLED Sports Activity Bracelet - Navy Blue
gid://shopify/Product/9272316363094,aquarius-blue-finger-pulse-oximeter-version-2-oxygen-saturation-monitor-spo2-readings-heart-rate-monitor-fda-approved,Aquarius Blue Finger Pulse Oximeter V2 - Oxygen Saturation & Heart Rate Monitor
gid://shopify/Product/9272316526934,aquarius-fitbit-charge-2-classic-replacement-straps-adjustable-metal-clasp,Aquarius Fitbit Charge 2 Classic Replacement Straps with Adjustable Metal Clasp
gid://shopify/Product/9272316625238,aquarius-fitbit-blaze-metal-mesh-band-casual-wristwatch-strap,Stylish Aquarius Fitbit Blaze Metal Mesh Band Wristwatch Strap
gid://shopify/Product/9272316789078,gymcline-body-analysis-scale-bmi-report-daily-calorie-intake-guide-silver,Gymcline Body Analysis Scale with BMI Report & Daily Calorie Intake Guide - Silver
gid://shopify/Product/9272317051222,fitbit-charge2-classic-replacement-straps-adjustable-metal-clasp-hotpink,Fitbit Charge 2 Classic Replacement Straps - Adjustable Metal Clasp in Hot Pink
gid://shopify/Product/9272317280598,aquarius-holes-soft-silicone-replacement-strap-band-fitbit-charge-3,Aquarius Soft Silicone Replacement Strap Band for Fitbit Charge 3
gid://shopify/Product/9272317509974,aquarius-nike-silicone-replacement-strap-band-fitbit-charge-3,Aquarius Nike Silicone Replacement Band for Fitbit Charge 3
gid://shopify/Product/9272317706582,unbreakable-outdoor-water-bottle-550ml,Unbreakable Outdoor Water Bottle - Sportz Fill And Go 550ml
gid://shopify/Product/9272317935958,aquarius-leak-proof-sports-water-bottle-spray-function-carry-strap-bpa-free-400ml-blue,Aquarius Leak Proof Sports Water Bottle with Spray Function and Carry Strap - BPA Free - Blue - 400ml
gid://shopify/Product/9272318099798,aquarius-thermal-neoprene-face-neck-mask-blue,Blue Aquarius Thermal Neoprene Face & Neck Mask - Warm & Breathable Biker Mask
gid://shopify/Product/9272318263638,aquarius-milanese-replacement-strap-fitbit-alta-black,Aquarius Milanese Replacement Strap Band for Fitbit Alta - Black
gid://shopify/Product/9272318460246,aquarius-milanese-replacement-strap-band-fitbit-charge-2-silver,Silver Milanese Replacement Strap for Fitbit Charge 2
gid://shopify/Product/9272318722390,non-slip-skid-pilates-yoga-socks-anti-slip-full-toe-with-grips-cotton-pink,Non Slip Pink Pilates Yoga Socks with Grips Cotton Full Toe
gid://shopify/Product/9272318951766,aquarius-milanese-replacement-strap-band-fitbit-alta-rose-gold,Aquarius Milanese Replacement Strap Band for Fitbit Alta - Rose Gold
gid://shopify/Product/9272319181142,aquarius-aq112-fitness-tracker-heart-rate-monitor-purple,Aquarius AQ112 Fitness Tracker with Heart Rate Monitor - Purple
gid://shopify/Product/9272319410518,aquarius-thermal-neoprene-face-neck-mask-warm-breathable-biker-mask-red,Aquarius Thermal Neoprene Face & Neck Mask - Red
gid://shopify/Product/9272319607126,aquarius-milanese-replacement-strap-band-fitbit-alta-silver,Aquarius Milanese Replacement Strap Band for Fitbit Alta - Silver
gid://shopify/Product/9272319836502,aquarius-milanese-replacement-strap-fitbit-charge2-rose-gold,Aquarius Milanese Replacement Strap Band for Fitbit Charge 2 - Rose Gold
gid://shopify/Product/9272320033110,tidyz-drawstring-refuse-sacks-bin-bags-black-50l-pack-selection,Tidyz Drawstring Refuse Sacks Bin Bags - Black - 50L - Choose Your Pack
gid://shopify/Product/9272320262486,haven-5pcs-micro-fibre-mini-towel-gift-set-assorted-colour,Haven Micro Fibre Mini Towel Gift Set - Assorted Colors
gid://shopify/Product/9272320524630,reebok-womens-multi-pack-frankie-crop-top-size-color,Reebok Women's 2-Pack Frankie Crop Top - Various Sizes & Colors Available
gid://shopify/Product/9272320819542,portable-nano-mist-sprayer-handheld-rose-gold,Portable Rose Gold Nano Mist Sprayer - Handheld 2-in-1
gid://shopify/Product/9272321081686,centred-en-root-scalp-treatment-deluxe-detox-one-month-supply-4x3ml,Centred En-Root Scalp Treatment Deluxe Detox - One Month Supply
gid://shopify/Product/9272321245526,3pcs-nail-clipper-tweezer-eyelash-curler-rose-gold-professional-styling,Rose Gold Professional Nail Clipper - Tweezer - and Eyelash Curler Set
gid://shopify/Product/9272321376598,aquarius-safety-leather-case-razor-travel-case-black,Aquarius Safety Leather Razor Travel Case in Black
gid://shopify/Product/9272321507670,pretty-makeup-beauty-blending-sponge-latex-free-purple,Latex-Free Purple Beauty Blending Sponge for Flawless Makeup Application
gid://shopify/Product/9272321671510,envie-uv-led-6w-light-beads-nail-gel-polishes-white,Envie UV LED 6W Light Beads Nail Gel Polishes - White
gid://shopify/Product/9272321835350,foot-care-massage-five-fingers-toes-compression-socks,Five Finger Toe Compression Socks for Foot Care Massage
gid://shopify/Product/9272322130262,love-my-ink-tattoo-spray-sensitive-skin-dermatologically-tested-30ml,Love My Ink Tattoo Spray for Sensitive Skin - Dermatologically Tested - 30ml
gid://shopify/Product/9272322261334,carex-hw-liq-500ml-doy-mst-pls-eco-gb,Carex Hand Wash Liquid 500ml Eco-Friendly Dispenser
gid://shopify/Product/9272322425174,aquarius-metal-glam-finger-spinners-lip-balm-purple,Aquarius Metal Glam Finger Spinner with Lip Balm in Purple
gid://shopify/Product/9272322621782,beauty-beast-inspired-rose-makeup-brushes-glossy-handles,Rose Makeup Brushes with Glossy Handles - Beauty and the Beast Inspired
gid://shopify/Product/9272322720086,beauty-beast-inspired-rose-makeup-brushes-glossy-handles-1,Rose Makeup Brushes with Glossy Handles - Beauty and the Beast Inspired
gid://shopify/Product/9272322883926,beauty-beast-rose-makeup-brushes-glossy-handles,Rose Makeup Brushes with Glossy Handles - Beauty and the Beast Inspired
gid://shopify/Product/9272323014998,aquarius-desktop-charging-dock-braided-cables-rose-gold-blue-grey,Aquarius Desktop Charging Dock with Braided Cables - Rose Gold | Blue | Grey
gid://shopify/Product/9272323113302,6-packets-satya-palo-santo-backflow-dhoop-cones,Satya Palo Santo Backflow Dhoop Cones Set of 6 Packets
gid://shopify/Product/9272323244374,6-packets-satya-white-sage-backflow-dhoop-cones,Satya White Sage Backflow Dhoop Cones - Set of 6 Packets
gid://shopify/Product/9272323440982,satya-dragons-blood-backflow-dhoop-cones-6-pack,Satya Dragon's Blood Backflow Dhoop Cones - Set of 6 Packets
gid://shopify/Product/9272323604822,6-pack-satya-lavender-backflow-dhoop-cones,Satya Lavender Backflow Dhoop Cones - Set of 6 Packets
