Id,Handle,Title
gid://shopify/Product/9272201281878,speech-bubble-light-box-oval-sbox12,Oval Speech Bubble Light Box - SBox
gid://shopify/Product/9272201412950,asab-7pc-bbq-tools-set,Premium 7-Piece BBQ Tools Set by ASAB
gid://shopify/Product/9272201544022,zz-simply-4-pets-cooling-gel-pet-mat-mx-10198-twl-1609-as-92413-petcp-20,ZZ Simply 4 Pets Cooling Gel Pet Mat - Medium Size
gid://shopify/Product/9272201675094,garden-weed-burner-as09395-as9395-68449c-gh006-680025-dgi7945-weedb24-5056157909395,Garden Weed Burner - Powerful Weed Control Tool
gid://shopify/Product/9272201904470,just-essentials-exercise-slimming-belt,Exercise Slimming Belt by Just Essentials
gid://shopify/Product/9272202035542,3-tier-stainless-steel-steamer-25cm-as-94073,Premium 3 Tier Stainless Steel Steamer - 25cm
gid://shopify/Product/9272202199382,large-grey-pet-food-storage-scoop-as-70562-twl-1767-mx-10303,Large Grey Pet Food Storage & Scoop - Stylish and Functional Solution for Pet Owners!
gid://shopify/Product/9272202297686,lycopene-15mg-90-capsules-prowise-healthcare,Lycopene 15mg Capsules - Prowise Healthcare | 90 Count
gid://shopify/Product/9272202494294,vivid-extendable-window-cleaning-kit-gem-cle0846-as-41715,Vivid Extendable Window Cleaning Kit - GEM-CLE0846
gid://shopify/Product/9272202625366,bamboo-memory-foam-pillow-as-61478-bambo-10-bamboo-memory-foam-pillow-as-61478-bambo-10,Bamboo Memory Foam Pillow BAMBO-10
gid://shopify/Product/9272202756438,asab-a4-expanding-organiser-file-black,ASAB A4 Black Expanding Organiser File
gid://shopify/Product/9272203051350,asab-25kg-folding-trolley-cart-red-am-s5650-as-97439,ASAB 25kg Folding Trolley Cart - Red
gid://shopify/Product/9272203379030,chrome-bathroom-accessory-storage-trolley-shower-caddy-roll-holder-iron-wire,Chrome Bathroom Accessory Storage Trolley Shower Caddy Roll Holder
gid://shopify/Product/9272203575638,unisex-luxury-soft-plush-fleece-bathrobe-dressing-gown-warm-comfort-cosy-shower,Luxury Soft Plush Fleece Unisex Bathrobe Dressing Gown | Warm and Cozy for Ultimate Comfort
gid://shopify/Product/9272203936086,asab-portable-camping-gas-stove-black-651046-dgi-2200-cg-2500-ms-2500-bdz-155-a-n1054-n-5585-oo3954-66091c,ASAB Portable Camping Gas Stove in Black
gid://shopify/Product/9272204263766,jilong-led-light-swim-ring-90cm-diameter,Jilong LED Light Swim Ring - 90cm
gid://shopify/Product/9272204820822,faux-mink-throw-blanket-as-15129-200x240-cm-charcoal,Faux Mink Throw Blanket 200 x 240 cm in CHARCOAL
gid://shopify/Product/9272205115734,grey-over-radiator-clothes-airer-as-87846,Grey Over Radiator Clothes Airer - Stylish & Space-Saving Solution
gid://shopify/Product/9272205410646,grey-over-radiator-clothes-airer-as-87846,GREY Over Radiator Clothes Airer - Space-Saving Laundry Solution
gid://shopify/Product/9272205869398,2x-flocked-hangers-black-10pk-dgi-4017,Flocked Black Hangers 10 Pack - DGI-4017
gid://shopify/Product/9272206262614,flocked-hangers-black-10pk-dgi-4017,Flocked Black Hangers 10 Pack - DGI-4017
gid://shopify/Product/9272206917974,flocked-hangers-pink-10pk-dgi-4018,Flocked Pink Hangers 10-Pack
gid://shopify/Product/9272207180118,2x-flocked-hangers-pink-10pk-dgi-4018-as-99122-would-be-2x-flocked-hangers-pink-10pk-dgi-4018-as-99122,Flocked Pink Hangers - Set of 10
gid://shopify/Product/9272207376726,wooden-shoe-stretcher-mens-as-06295-dgi-0740,Men's Wooden Shoe Stretcher AS-06295 DGI-0740
gid://shopify/Product/9272207835478,400-thread-count-cotton-rich-paisley-print-duvet-cover-set-red,Red Paisley Print Cotton Rich Duvet Cover Set with 400 Thread Count
gid://shopify/Product/9272207999318,400-tc-cotton-rich-paisley-print-duvet-cover-set-ivory,Cotton Rich Paisley Print Ivory Duvet Cover Set - 400 Thread Count
gid://shopify/Product/9272208359766,400-tc-cotton-rich-paisley-print-duvet-cover-set-dark-grey,Cotton Rich Paisley Print Duvet Cover Set in Dark Grey - 400 Thread Count
gid://shopify/Product/9272208621910,400-thread-count-cotton-rich-paisley-print-duvet-cover-set-caramel,Premium Cotton Rich Paisley Print Duvet Cover Set in Caremel - 400 Thread Count
gid://shopify/Product/9272209113430,asab-granite-pestle-mortar-as-41517,ASAB Granite Pestle & Mortar - Premium Kitchen Tool
gid://shopify/Product/9272209441110,wooden-shoe-stretcher-mens-size-6-12-dgi-0740-twl-291-dgi-9765-as-06295,Wooden Shoe Stretcher for Men | Size 6-12
gid://shopify/Product/9272209703254,wooden-shoe-stretcher-ladies-sizes-3-8-as-92475-as-06301-dgi-0741-dgi-9772-5060138819184,Premium Wooden Shoe Stretcher for Women | Suitable for Shoe Sizes 3-8
gid://shopify/Product/9272209998166,automatic-card-shuffler-twl-1291-as-48974,Premium Automatic Card Shuffler - TWL-1291
gid://shopify/Product/9272210227542,3x-2pk-stick-click-led-lights-push-ele0409,Stick n Click LED Lights Push - Pack of 2 - ELE0409
gid://shopify/Product/9272210489686,elf-dummy-child-surveillance-camera-led-as-24046,Elf Dummy Child Surveillance Camera With Flashin LED
gid://shopify/Product/9272210850134,summit-wine-bottle-holder-2-wine-glasses-holder,Summit Wine Bottle and 2 Glasses Holder Set
gid://shopify/Product/9272211112278,tobar-inflatable-globe-07734,Tobar Inflatable Globe - High Quality Educational Tool
gid://shopify/Product/9272211571030,interior-dehumidifier-damp-moisture-mould-mildew-remover-trap-home-caravan,Interior Dehumidifier Damp Moisture Mold Mildew Remover Trap for Home and Caravan
gid://shopify/Product/9272211800406,centrefeed-blue-roll-6,Blue Centrefeed Roll - 6 Pack
gid://shopify/Product/9272212128086,trust-york-hardcase-sleeve-13-14-laptop-bag,York Hardcase Sleeve 13-14” Laptop Bag - Ultimate Protection for Your Device
gid://shopify/Product/9272212390230,wm-widdop-quartz-travel-alarm-black-case-dial,Wm Widdop Quartz Travel Alarm Clock - Black
gid://shopify/Product/9272212652374,amplus-bedside-travel-analogue-yellow-alarm-clock-pd818y,Amplus Bedside Travel Analogue Yellow Alarm Clock
gid://shopify/Product/9272213012822,champion-silent-sweep-silver-alarm-clock-mf888s,Silent Sweep Silver Champion Alarm Clock
gid://shopify/Product/9272213274966,radiator-airer-5-adjustable-arms-drying-clothes-max-temp-70c,Adjustable Arm Radiator Airer for Drying Clothes with Max Temp 70c
gid://shopify/Product/9272213537110,interior-dehumidifier-damp-moisture-mould-mildew-remover-trap-home-caravan,Interior Dehumidifier Damp Moisture Mould Mildew Remover Trap for Home and Caravan
gid://shopify/Product/9272213668182,cooling-gel-mat-pad-pack-2-40x30cm-as-02341,2-Pack Cooling Gel Mat Pad 40 x 30cm
gid://shopify/Product/9272213930326,asab-adhesive-pile-weatherstrip,ASAB Adhesive Pile Weatherstrip - Ultimate Seal for Doors and Windows
gid://shopify/Product/9272214225238,asab-4pk-hammer-lawn-edging-edge-garden-fence-brick-effect-1-0331,ASAB Hammer Lawn Edging Garden Fence Brick Effect
gid://shopify/Product/9272214520150,asab-led-projector-light-bulb-hearts,ASAB Hearts LED Projector Light Bulb
gid://shopify/Product/9272214716758,1st-aid-embossed-disposable-pe-gloves-100-pack-pms-839190,Embossed Disposable PE Gloves - 100 Pack
gid://shopify/Product/9272215011670,asab-yoga-foam-roller-black-as-04045,ASAB Yoga Foam Roller Black
gid://shopify/Product/9272215273814,asab-ionic-shower-head,ASAB IONIC Shower Head - Ultimate Water-saving Luxury for Your Bathroom
gid://shopify/Product/9272215535958,asab-20-pack-wooden-hangers,ASAB Wooden Hangers - Pack of 20
gid://shopify/Product/9272215798102,rectangular-bamboo-laundry-basket-natural-divider,Bamboo Laundry Basket with Divider - Natural
gid://shopify/Product/9272216093014,rectangular-bamboo-laundry-basket-white-divider,White Rectangular Bamboo Laundry Basket with Divider - Organize Your Laundry Efficiently
gid://shopify/Product/9272216355158,red-xmas-bag-side-pocket,Red Christmas Bag with Side Pocket
gid://shopify/Product/9272216584534,soka-stacking-cube-6-vehicles-0000464,SOKA Stacking Cube Set with 6 Toy Vehicles
gid://shopify/Product/9272216879446,soka-wooden-blocks-100pcs-new-color-0000463,SOKA Wooden Blocks 100pcs in New Color
gid://shopify/Product/9272217174358,2-pack-round-turntable-organizer-non-slip-spice-rack-medium,Round Turntable Spice Rack Organizer - Non-Slip Multifunctional Design (Medium)
gid://shopify/Product/9272217305430,soka-dental-hospital-0000480,Soka Dental Hospital
gid://shopify/Product/9272217567574,soka-cash-register-red-mint-0000475,Soka Red & Mint Cash Register
gid://shopify/Product/9272217796950,soka-magnetic-cake-stand-heart-0000471,SOKA Magnetic Cake Stand - Heart
gid://shopify/Product/9272218026326,soka-mini-ice-cream-shop-0000477,SOKA Mini Ice Cream Shop
gid://shopify/Product/9272218681686,vinsani-12pcs-ss-long-handle-latte-spoons-1010049,Vinsani Stainless Steel Long Handle Latte Spoons - Set of 12
gid://shopify/Product/9272219009366,soka-camping-country-side-0000487,Soka Camping-Countryside Adventure Tent
gid://shopify/Product/9272219238742,vinsani-15pcs-cocktail-set-1010052-could-be-vinsani-15pcs-cocktail-set,Vinsani Cocktail Set - 15pcs
gid://shopify/Product/9272219533654,my-first-workbench-soka-0000462,SOKA My First Workbench
gid://shopify/Product/9272219861334,vinsani-red-xmas-bag-0000502-vinsani-red-xmas-bag-0000502,Red Christmas Gift Bag by Vinsani - Festive Holiday Packaging
gid://shopify/Product/9272220189014,soka-doll-world-pram-0000470,SOKA Doll World Pram - Stylish Doll Accessory for Imaginative Play
gid://shopify/Product/9272220418390,soka-flower-garden-building-set-0000437,Soka Flower Garden Building Set
gid://shopify/Product/9272220614998,soka-first-toolbox-0000461,SOKA My First Tool Box - Complete Guide for DIY Enthusiasts
gid://shopify/Product/9272220942678,magnifying-glass-light-led-illuminated-magnifier-3x-45x-magnification-reading-jewellery-loupe-handheld,LED Illuminated Magnifying Glass with 3X 45X Magnification for Reading | Jewellery Loupe Handheld
gid://shopify/Product/9272221335894,seasons-7-chakra-gift-pack-agarbatti-joss-free-burner-140-incense-sticks,7 Chakra Gift Pack Incense Sticks with Free Burner - 140 Incense Sticks
gid://shopify/Product/9272221565270,magic-multi-functional-cool-gel-pads-2-pack,Multi Functional Cool Gel Pads - Set of 2 | Ultimate Magic Relief
gid://shopify/Product/9272221827414,10-pack-magic-clothes-hangers-space-saving-organizer,Magic Clothes Hangers - Space Saving Organizer Pack
gid://shopify/Product/9272221991254,knight-3-section-laundry-storage-basket-120l-collapsible-on-wheels-mesh-cover-grey,Grey KNIGHT Laundry Storage Basket with Wheels and Mesh Cover - 120L Capacity
gid://shopify/Product/9272222318934,knight-2-section-laundry-storage-basket-120l-collapsible-wheels-mesh-cover-grey,Collapsible 120L Laundry Storage Basket with Wheels and Mesh Cover in Grey
gid://shopify/Product/9272222679382,knight-light-weight-laundry-storage-basket-60l-collapsible-wheels-mesh-cover-grey,Light Weight Laundry Storage Basket 60L with Wheels and Mesh Cover - Grey
gid://shopify/Product/9272222941526,100-3ft-bamboo-canes-sticks-90cm,3FT Bamboo Canes Sticks 90 CM - Pack of 100
gid://shopify/Product/9272223170902,20-6ft-180cm-bamboo-canes,6FT (180cm) High-Quality Bamboo Canes - Pack of 20
gid://shopify/Product/9272223596886,one-piece-4ft-bamboo-cane-120cm,Natural 4ft Bamboo Cane - Ideal for Gardening and Decor - 120cm Length
gid://shopify/Product/9272223859030,100x-5ft-bamboo-canes-150cm,Bundle of 100x 5FT Bamboo Canes
gid://shopify/Product/9272224088406,40-6ft-180cm-bamboo-canes,6FT Bamboo Canes - Pack of 40 (180cm) - Premium Quality
gid://shopify/Product/9272224350550,60-bamboo-canes-90cm,Natural 3FT Bamboo Canes Sticks - Pack of 60
gid://shopify/Product/9272224678230,80-bamboo-canes-sticks-4ft-120cm,Natural Bamboo Canes 4FT 120cm Pack of 80
gid://shopify/Product/9272224842070,50-3ft-bamboo-canes-sticks-90cm,Pack of 50 3FT Bamboo Canes Sticks - 90CM Length
gid://shopify/Product/9272225071446,10-3ft-bamboo-canes-sticks-90cm,Bamboo Canes Sticks 90CM - Pack of 10
gid://shopify/Product/9272225333590,30-bamboo-canes-90cm,30-Pack 3FT Bamboo Canes Sticks - 90CM Length
gid://shopify/Product/9272225726806,20-bamboo-canes-5ft-150cm,5FT Bamboo Canes Pack - Set of 20 Sturdy 150 CM Plant Supports
gid://shopify/Product/9272225923414,20-4ft-bamboo-canes-sticks-120cm,Natural 4FT Bamboo Canes Sticks - Pack of 20 | 120cm Length
gid://shopify/Product/9272226185558,50-6ft-180cm-bamboo-canes,6FT (180cm) Bamboo Canes - Pack of 50
gid://shopify/Product/9272226447702,30-4ft-bamboo-canes-sticks-120cm,Natural Bamboo Canes Sticks - Pack of 30 | 4FT (120cm)
gid://shopify/Product/9272226677078,50-5ft-bamboo-canes-150cm,5FT Bamboo Canes - Pack of 50 - 150 CM Length
gid://shopify/Product/9272226840918,40-3ft-bamboo-canes-sticks-90cm,Pack of 40 Natural Bamboo Canes - Length 90CM
gid://shopify/Product/9272227168598,40-bamboo-canes-5ft-150cm,5FT Bamboo Canes 150 CM - Pack of 40
gid://shopify/Product/9272227430742,100-4ft-bamboo-canes-sticks-120cm,4FT Bamboo Canes Sticks - Pack of 100 (120cm)
gid://shopify/Product/9272227725654,40-4ft-bamboo-canes-sticks-120cm,Natural Bamboo Canes - Pack of 40 | 4ft (120cm) Sticks
gid://shopify/Product/9272227955030,200-3ft-bamboo-canes-sticks-90cm,Premium 200 Pack of 3FT Bamboo Canes Sticks - Quality 90CM Length
gid://shopify/Product/9272228741462,industrial-e27-black-light-ceiling-pendant-lampshade-fitting-kit,Black Industrial E27 Ceiling Pendant Light Cage Hanging Lampshade Kit
gid://shopify/Product/9272229626198,durastone-professional-crisper-oven-tray-family-size,Durastone Professional Crisper and Oven Tray Set - Family Size
gid://shopify/Product/9272229888342,the-bailey-fair-isle-white-on-red,The Bailey Fair Isle White Red Sweater
gid://shopify/Product/9272230150486,freezer-blocks-family-pack-reusable-keeps-food-drink-cooler-hours-ice-lunch-boxes-outdoor-picnic-camping,Reusable Freezer Blocks Family Pack - Keep Food and Drinks Cool for Hours | Ice Blocks for Lunch Boxes | Outdoor Picnics | Camping
gid://shopify/Product/9272230445398,sterun-reusable-ice-pack-cool-box-freezer-blocks-lunch-boxes-camping-picnic-frozen-blocks-ice-packs-coolers,Sterun Reusable Ice Pack for Cool Box - Long Lasting Small Cold Pack for Lunch Boxes | Camping & Picnic
gid://shopify/Product/9272230707542,the-jazz-dog-jumper-camel,Stylish Jazz Dog Jumper - Camel
gid://shopify/Product/9272231035222,vinsani-3pcs-boro-set-1010317,Vinsani Borosilicate Glass Set - 3-Piece Set
gid://shopify/Product/9272231428438,vinsani-double-wall-glasses-verre-1010313,Vinsani Double Wall Glass Set - Best Quality Insulated Glasses
gid://shopify/Product/9272231723350,vinsani-double-wall-glasses-casa-1010316,Vinsani Double Wall Casa Glasses
gid://shopify/Product/9272231919958,bailey-fair-isle-teal-grey,The Bailey Fair Isle Teal Grey Knit Sweater
gid://shopify/Product/9272232345942,vinsani-double-wall-glasses-vaso-1010311,Vinsani Double Wall Glass - Vaso
gid://shopify/Product/9272232673622,vinsani-double-wall-glasses-copa-1010310,Vinsani Double Wall Glasses Copa
gid://shopify/Product/9272232837462,vinsani-double-wall-glasses-pivano-1010315,VINSANI Double Wall Glass PIVANO
gid://shopify/Product/9272233132374,vinsani-double-wall-glasses-koppu-1010314,Vinsani Double Wall Glasses Koppu
gid://shopify/Product/9272233394518,rusted-dove-sign-metal-home-garden-ornament-bird-animal-feature-wall-fence,Rusted Dove Metal Garden Ornament Sign Feature for Home Decor
gid://shopify/Product/9272233656662,inflatable-christmas-santa-claus-4ft-led-yard-holiday-decoration,4ft LED Inflatable Santa Claus Yard Holiday Decoration - Christmas Festive
gid://shopify/Product/9272233918806,4ft-inflatable-christmas-santa-claus-gift-led-xmas-holiday-outdoor,Inflatable Christmas Santa Claus Gift with LED Lights for Holiday Outdoor Decor
gid://shopify/Product/9272234180950,inflatable-christmas-santa-claus-xmas-deco-led-air-blown-yard-outdoor,Inflatable Christmas Santa Claus Xmas Decoration with LED Lights for Yard Outdoor Decor
gid://shopify/Product/9272234443094,witch-ghost-halloween-inflatable-led-pumpkin-lantern,Haunted Halloween Inflatable Pumpkin Lantern with LED Lights - Weather-Resistant
gid://shopify/Product/9272234639702,5ft-inflatable-christmas-tree-xmas-air-blown-led-lawn-yard-outdoor-ornaments,Inflatable Christmas Tree with LED Lights for Outdoor Decor
gid://shopify/Product/9272234869078,5ft-indoor-christmas-tree-artificial-deco-xmas-gift-metal-stand-416-tips,Premium 5ft Artificial Indoor Christmas Tree with Metal Stand and 416 Tips
gid://shopify/Product/9272235098454,asab-foldable-trash-bin-white-grey,Foldable Trash Bin in White/Grey - ASAB
gid://shopify/Product/9272235589974,asab-gel-eye-mask-pink-05053,ASAB Pink Gel Eye Mask
gid://shopify/Product/9272235819350,centrefeed-white-roll-6,White Centrefeed Roll - 6-Pack
gid://shopify/Product/9272235983190,intt-deep-throat-spray,Intt Deep Throat Spray - Oral Desensitizing Spray
gid://shopify/Product/9272236245334,9kg-traditional-parasol-base-iron-cast-garden-as-04520,9KG Traditional Iron Cast Garden Parasol Base for ASAB
gid://shopify/Product/9272236507478,asab-vinyl-padded-metal-folding-chair-as-06210,Vinyl Padded Metal Folding Chair - ASAB AS-06210
gid://shopify/Product/9272236736854,asab-insect-hotel,ASAB Insect Hotel - Premium Habitat for Garden Insects
gid://shopify/Product/9272236933462,ice-grippers-non-slip-ice-snow-074-450-xl-ziz000887xl,Ice Grippers Non-Slip for XL ZIZ000887
gid://shopify/Product/9272237130070,35kg-folding-shopping-trolley-asab-black-dgi-2933a-as-41497-dgi-4753,Folding Shopping Trolley ASAB BLACK
gid://shopify/Product/9272237326678,temperature-strip-751097-as-14772-5050565503343,Temperature Strip for Accurate Home Temperature Monitoring
gid://shopify/Product/9272237523286,18m-tilting-parasol-umbrella-blue-as-17483,Tilting Blue Parasol Umbrella - Stylish and Functional Shade Solution
gid://shopify/Product/9272237883734,asab-white-fence-garden-edging-as-07798,ASAB White Fence Garden Edging
gid://shopify/Product/9272238080342,cat-radiator-bed-45x31x24cm-2339-grey-with-paw-print,Grey Cat Radiator Bed with Paw Print - Size 45x31x24cm
gid://shopify/Product/9272238375254,2pc-deluxe-storage-bags-black,Deluxe Black Storage Bags Set of 2 - Organize in Style!
gid://shopify/Product/9272238637398,vinsani-chrome-24-coffee-pod-stand-1010279,Vinsani Chrome Coffee Pod Stand
gid://shopify/Product/9272238866774,cat-tree-scratcher-kitty-activity-play-center-post-2-perch-hanging-sisal-rope,Kitty Cat Tree Scratcher Activity Play Center Perch with Hanging Sisal Rope
gid://shopify/Product/9272239096150,cat-tree-climbing-activity-center-scratching-massage-board-hanging-ball,Climbing Cat Tree Activity Center with Scratching Board and Hanging Ball
gid://shopify/Product/9272239292758,elevated-pet-bed-cool-cot-dog-cat-portable-folding-home-camping-hammock-foldable,Elevated Pet Bed Cool Cot for Dogs and Cats - Portable Folding Hammock for Home | Camping | and Outdoors
gid://shopify/Product/9272239620438,side-table-sofa-snack-wooden-modern-coffee-table-metal-base-walnut,Sleek Walnut Side Table with Metal Base for Modern Sofas
gid://shopify/Product/9272239882582,pet-bed-raised-cot-dog-cat-elevated-puppy-hammock-camping-portable-waterproof,Portable Waterproof Pet Bed Raised Cot for Dogs and Cats - Elevated Hammock for Puppies | Ideal for Camping
gid://shopify/Product/9272240144726,pets-carrier-folding-bag-car-seat-cat-dog-puppy-portable-travel-cage-mesh-holder,Folding Pets Carrier Bag Car Seat for Cats and Dogs - Portable Travel Cage with Mesh Holder
gid://shopify/Product/9272240439638,folding-fabric-soft-pet-crate-dog-cat-travel-carrier-cage-kennel-house-brown,Folding Soft Fabric Pet Crate Kennel House for Dogs and Cats - Brown Travel Carrier
gid://shopify/Product/9272240537942,elevated-pet-bed-cool-cot-dog-cat-portable-folding-home-camping-hammock-foldable-1,Portable Folding Elevated Pet Bed Cool Cot Hammock for Dogs and Cats
gid://shopify/Product/9272240701782,elevated-pet-bed-cool-cot-dog-cat-portable-folding-home-camping-hammock-foldable-2,Portable Elevated Pet Bed for Dogs and Cats - Folding Cot for Home | Camping and Hammock Use
gid://shopify/Product/9272241029462,cat-tree-plush-scratcher-kitty-activity-play-center-bar-tunnel-dangling-ball,Plush Cat Tree Scratcher Activity Play Center with Top Ba | Tunnel and Dangling Ball
gid://shopify/Product/9272241291606,wood-cat-shelf-shelter-kitten-bed-curved-climber-wall-mounted-berber-fleece,Curved Wall-Mounted Wood Cat Shelf Climber Bed with Berber Fleece Shelter for Kittens
gid://shopify/Product/9272241553750,fabric-pet-puppy-dog-cat-rabbit-pig-guinea-playpen-run-s-m-l-3-colour,Pet Playpen Run for Dogs |Cats | Rabbits | Guinea Pigs
gid://shopify/Product/9272241848662,raised-pet-feeder-elevated-double-stainless-steel-bowls-stand-water-white,Double Stainless Steel Raised Pet Feeder Stand with Elevated Water Bowls - White
gid://shopify/Product/9272242209110,wood-cat-shelf-shelter-kitten-bed-curved-climber-wall-mounted-berber-fleece-1,Curved Cat Shelf Climber with Berber Fleece - Wall-Mounted Kitten Bed Shelter
gid://shopify/Product/9272242340182,diy-pet-playpen-metal-wire-fence-12-panel-guinea-pig-small-animals-cage-black,Metal Wire 12-Panel Guinea Pig Small Animal Cage Playpen in Black
gid://shopify/Product/9272242667862,portable-pet-paddling-pool-swimming-bath-cat-dog-puppy-foldable-blue-80cm,Foldable Blue Portable Pet Paddling Pool Swimming Bath for Cat Dog Puppy (80cm)
gid://shopify/Product/9272243028310,cat-scratcher-sisal-scratching-pad-mat-board-kitten-toy-with-roller-feather-teaser,Cat Scratcher Sisal Scratching Pad Board with Roller Feather Teaser Toy
gid://shopify/Product/9272243290454,pet-bed-raised-cot-dog-cat-elevated-puppy-hammock-camping-portable-waterproof-1,Portable Waterproof Pet Bed Raised Cot for Dogs and Cats - Elevated Puppy Hammock Perfect for Camping
gid://shopify/Product/9272243519830,cat-tree-scratcher-kitty-activity-play-center-post-2-perch-hanging-sisal-rope-1,Cat Tree Scratcher Activity Center with Perch and Sisal Rope
gid://shopify/Product/9272243749206,elevated-pet-bed-cool-cot-dog-cat-portable-folding-home-camping-hammock-foldable-3,Elevated Pet Bed Cool Cot Portable Home Camping Hammock for Dogs and Cats
gid://shopify/Product/9272243978582,100-50-150cm-greenhouse-steel-frame-pvc-cover-roll-up-door-outdoor-green,Greenhouse Steel Frame PVC Cover with Roll-up Door - Outdoor Green
gid://shopify/Product/9272244240726,3-tier-mini-greenhouse-roll-up-door-wire-shelves-69x49x125cm-clear,Mini Greenhouse with Roll Up Door and Wire Shelves
gid://shopify/Product/9272244502870,bamboo-laundry-hamper-removable-lining-large-section-double,Bamboo Laundry Hamper with Removable Lining and Large Double Section
gid://shopify/Product/9272244797782,70l-2-compartment-bamboo-laundry-basket-grey,Grey Bamboo 2-Compartment Laundry Basket - Large Capacity
gid://shopify/Product/9272244994390,5l-steel-step-trash-can-quiet-closed-lid-silent-gentle-open,Steel Step Trash Can with Silent-Close Lid for Gentle with Quiet Operation
gid://shopify/Product/9272245289302,work-bench-saw-horse-clamp-table-diy-home-garage-grey,Work Bench Saw Horse Clamp Table - DIY Garage Essential in Grey
gid://shopify/Product/9272245453142,modern-design-mini-style-flush-mount-ceiling-light-metal-white,Contemporary Mini Flush Mount Ceiling Light - Metal White Flush Design
gid://shopify/Product/9272245649750,crystal-chandelier-spiral-rain-drop-silver-crystal,Modern Silver Crystal Spiral Chandelier Pendant Light
gid://shopify/Product/9272245879126,steel-duo-head-floor-lamp-silver,Modern Steel Duo-Head Silver Floor Lamp for Stylish Home Décor
gid://shopify/Product/9272246042966,durhand-pp-wall-mounted-garage-tool-organizer-unit-grey-red,DURHAND Wall Mounted Garage Tool Organizer - Grey/Red
gid://shopify/Product/9272246272342,loving-joy-furry-handcuffs-pink,Loving Joy Pink Furry Handcuffs - Enhance Your Bedroom Playtime
gid://shopify/Product/9272246501718,360-degree-swivel-seat-shower-stool-adjustable-height-aluminium-homcom,Adjustable Height Aluminium Swivel Shower Stool by HOMCOM
gid://shopify/Product/9272246632790,adjust-aluminum-bath-stool-spa-shower-chair-non-slip-shower-hole,Aluminum Bath Stool Spa Shower Chair with Non-Slip Surface and Shower Hole
gid://shopify/Product/9272246796630,mobility-shower-bath-stool-bench-non-slip-aluminum-frame-homcom,Aluminum Mobility Shower and Bath Stool Bench with Non-Slip Frame by HOMCOM
gid://shopify/Product/9272246993238,bath-chair-shower-seat-safety-bathroom-elderly-aids-adjustable-position-homcom,Bath Chair Shower Seat - Adjustable Position for Elderly Safety by HOMCOM
gid://shopify/Product/9272247288150,5-5ft-artificial-slim-christmas-tree-holiday-home-decor-with-pine-cones-homcom,Artificial Slim Christmas Tree with Pine Cones by HOMCOM - Holiday Home Decor
gid://shopify/Product/9272247451990,ottoman-footrest-seat-chair-footstool-small-pu-leather-home-office-grey,Small Grey PU Leather Ottoman Footrest for Home Office
gid://shopify/Product/9272247648598,bamboo-laundry-basket-2-compartments-grey-homcom,Bamboo Laundry Basket with 2 Compartments - Grey HOMCOM
gid://shopify/Product/9272247845206,100l-bamboo-laundry-basket-2-compartments-washing-baskets-natural-homcom,Bamboo Laundry Basket with 2 Compartments - Natural HOMCOM
gid://shopify/Product/9272248107350,folding-square-rattan-coffee-table-bistro-balcony-garden-steel-outsunny,Folding Rattan Coffee Table Bistro Balcony Garden by Outsunny
gid://shopify/Product/9272248238422,beach-tent-instant-camping-pop-up-tent-sun-shade-shelter-green-outsunny,Outsunny Green Beach Tent Instant Pop Up Sun Shade Shelter
gid://shopify/Product/9272248467798,office-carpet-protector-chair-mat-spike-non-slip-chairmat-frosted-homcom,Non Slip Frosted HOMCOM Office Carpet Protector Chair Mat with Spike
gid://shopify/Product/9272248598870,kayak-wall-mount-rack-heavy-duty-storing-storage-hangers-canoe-fixings-homcom,Heavy Duty Kayak Wall Mount Rack Storage Hangers - HOMCOM
gid://shopify/Product/9272248828246,rebounder-net-practise-goal-play-kids-adults-baseball-soccer-training-homcom,Multi-Sport Rebounder Net for Baseball | Soccer Training - HOMCOM
